text,createTime,createTimeISO,isAd,profileUrl,musicName,musicId,webVideoUrl,duration,diggCount,shareCount,playCount,collectCount,commentCount,hashtags,isSlideshow,isSponsored,kol_username,ttSeller,commerceUser,is_trending,emoji_count,hashtag_count,word_count_no_emoji_hashtag,early_morning,morning,afternoon,evening,late_night,is_weekend
"Gần 1 tuần dị ứng bụi mịn, bột đá vì sửa nhà. Ăn đồ ngoài gần 1 tuần lên mấy mụn nóng thì nay da mới trộm vía ổn lại. Làn da nhạy cảm đỏng đảnh thật khó chiều 🥹",2024-07-12 21:39:48,12/07/2024,False,https://www.tiktok.com/@dieplinhcami,original sound - cloudy day,7381849507887123201,https://www.tiktok.com/@dieplinhcami/video/7390759041355631880,7,482,5,32100,18,13,,False,False,dieplinhcami,True,False,False,1,0,39,0,0,0,1,0,0
"Xin phép nhờ các bạn chia sẻ để tránh có thêm người bị lừa ạ, thực sự cảm ơn các bạn đã nhận ra và nhắn tin cho mình vì các bên ăn cắp chặn mình mọi nền tảng huhu #skincare #cami ",2024-07-12 15:43:55,12/07/2024,False,https://www.tiktok.com/@dieplinhcami,nhạc nền - Cami,7390667356265040656,https://www.tiktok.com/@dieplinhcami/video/7390667330814086408,44,106,1,10000,4,5,"skincare, cami",False,False,dieplinhcami,True,False,False,0,2,40,0,0,1,0,0,0
Trải nghiệm mua đất ở tuổi 26 😎 #cami #tiktok ,2024-07-12 14:52:40,12/07/2024,False,https://www.tiktok.com/@dieplinhcami,Vlog ・ Stylish city pop(1275391),7200478944389564418,https://www.tiktok.com/@dieplinhcami/video/7390654116252470546,54,496,0,25000,12,20,"cami, tiktok",False,False,dieplinhcami,True,False,False,1,2,7,0,0,1,0,0,0
Thủ tục không thể bỏ qua mỗi tối 🫶🏻 Massage sạch sâu #cami #tiktok #skincare ,2024-07-11 21:33:49,11/07/2024,False,https://www.tiktok.com/@dieplinhcami,nhạc nền - Chỉ còn lại mùa hè,7356233276321450768,https://www.tiktok.com/@dieplinhcami/video/7390386416448032018,7,243,2,21000,7,7,"cami, tiktok, skincare",False,False,dieplinhcami,True,False,False,1,3,11,0,0,0,1,0,0
"Trả lời @Traamm 10 năm như một cơn gió vậy, giờ thì đã cảm nhận rõ ràng “Vội Vàng” của Xuân Diệu 🍃 #cami #tiktok ",2024-07-06 18:31:34,06/07/2024,False,https://www.tiktok.com/@dieplinhcami,Vlog ・ Stylish city pop(1275391),7200478944389564418,https://www.tiktok.com/@dieplinhcami/video/7388484002165935361,47,1149,8,48600,36,30,", cami, tiktok",False,False,dieplinhcami,True,False,False,1,2,22,0,0,0,1,0,1
"Sửa nhà sửa cửa 😻 Tiện thể ai xem hết clip recommend cho tui 1 loại miếng dán mụn với. Đợt này ăn ngoài nhiều, không tập thể dục, stress rồi bụi bẩn nên toàn mụn sưng viêm 🥹 #Cami #tiktok #skincare #home ",2024-07-06 17:38:13,06/07/2024,False,https://www.tiktok.com/@dieplinhcami,Vlog ・ Stylish city pop(1275391),7200478944389564418,https://www.tiktok.com/@dieplinhcami/video/7388470252922785040,53,174,1,12000,3,6,"cami, tiktok, skincare, home",False,False,dieplinhcami,True,False,False,2,4,37,0,0,1,0,0,1
"Trải nghiệm kem chống nắng The Whoo vào một ngày trời râm mà tia UV cao 
#cami #tiktok #kcn  #THEWHOO #SUNQUID@The Whoo Vietnam ",2024-07-06 12:53:46,06/07/2024,False,https://www.tiktok.com/@dieplinhcami,Vlog ・ Stylish city pop(1275391),7200478944389564418,https://www.tiktok.com/@dieplinhcami/video/7388396961109413138,52,86,13,12800,8,7,"cami, tiktok, kcn, thewhoo, sunquid, ",False,False,dieplinhcami,True,False,False,0,5,19,0,0,1,0,0,1
"Một bữa cơm đồng quê giản dị của nhà tui, mời các bác ăn trưa #cami #tiktok #yeubepnghiennha ",2024-06-21 10:57:48,21/06/2024,False,https://www.tiktok.com/@dieplinhcami,Vlog ・ Stylish city pop(1275391),7200478944389564418,https://www.tiktok.com/@dieplinhcami/video/7382800808049511687,48,651,1,32200,9,12,"cami, tiktok, yeubepnghiennha",False,False,dieplinhcami,True,False,False,0,3,15,0,1,0,0,0,0
"Chăm sóc làn da nhạy cảm
#physiogel #duongdacanbang #chongnangtoiuu #duongamtoiuu #cami #skincare ",2024-06-20 12:45:31,20/06/2024,False,https://www.tiktok.com/@dieplinhcami,Vlog ・ Stylish city pop(1275391),7200478944389564418,https://www.tiktok.com/@dieplinhcami/video/7382457472247680264,55,1352,3,307100,13,2,"physiogel, duongdacanbang, chongnangtoiuu, duongamtoiuu, cami, skincare",False,False,dieplinhcami,True,False,False,0,6,6,0,0,1,0,0,0
Khui đồ mua tại Bidu cùng tui nha mấy nàng #cami #tiktok #bidu #biduhaul ,2024-06-13 19:57:47,13/06/2024,False,https://www.tiktok.com/@dieplinhcami,Vlog ・ Stylish city pop(1275391),7200478944389564418,https://www.tiktok.com/@dieplinhcami/video/7379971286723759367,63,317,6,204600,33,10,"cami, tiktok, bidu, biduhaul",False,False,dieplinhcami,True,False,False,0,4,10,0,0,0,1,0,0
Lại là chuyên mục nấu ăn cùng cô Linh 😉. Hôm nay nhà các bác ăn gì cmt để tui tham khảo với nhé #cami #tiktok #yeubepnghiennha ,2024-06-13 17:10:57,13/06/2024,False,https://www.tiktok.com/@dieplinhcami,Vlog ・ Stylish city pop(1275391),7200478944389564418,https://www.tiktok.com/@dieplinhcami/video/7379928287314742535,48,124,0,10100,2,6,"cami, tiktok, yeubepnghiennha",False,False,dieplinhcami,True,False,False,1,3,24,0,0,1,0,0,0
"Sáng nay ngủ dậy sớm mình  tập dãn cơ 1 chút và không lau mặt trước đó, tập xong mới nhớ ra check lượng dầu trên da và kết quả thế này 😉 #cami #tiktoker #skincare ",2024-06-13 16:48:02,13/06/2024,False,https://www.tiktok.com/@dieplinhcami,Vlog ・ Stylish city pop(1275391),7200478944389564418,https://www.tiktok.com/@dieplinhcami/video/7379922376026361095,27,256,1,17300,13,8,"cami, tiktoker, skincare",False,False,dieplinhcami,True,False,False,1,3,32,0,0,1,0,0,0
#CapCut Lấy chồng và được đính kèm mẹ chồng 🤭 #Cami #tiktok ,2024-06-11 15:09:18,11/06/2024,False,https://www.tiktok.com/@dieplinhcami,Vlog ・ Stylish city pop(1275391),7200478944389564418,https://www.tiktok.com/@dieplinhcami/video/7379154759393004807,37,3245,22,92700,48,42,"capcut, cami, tiktok",False,False,dieplinhcami,True,False,False,1,3,8,0,0,1,0,0,0
"#CapCut Xịt keo bài này quá đi, nghe xong muốn cưới lại lần nữa 🤭",2024-06-10 11:38:16,10/06/2024,False,https://www.tiktok.com/@dieplinhcami,nhạc nền - Ma cúc 🫧,7378127443502091009,https://www.tiktok.com/@dieplinhcami/video/7378729289283292423,23,1113,12,36600,30,11,capcut,False,False,dieplinhcami,True,False,True,1,1,13,0,1,0,0,0,0
"Mấy con mụn nóng sưng viêm do ăn đồ nóng lên các bạn thử nhé, tui đã thử và rất thành công hihi. Để mua 2 món này qua Cami sẵn nha các bạn iu #cami #tiktok #skincare ",2024-06-10 11:23:13,10/06/2024,False,https://www.tiktok.com/@dieplinhcami,nhạc nền - Cami,7378730597802396432,https://www.tiktok.com/@dieplinhcami/video/7378725405311765778,47,1357,23,68800,267,45,"cami, tiktok, skincare",False,False,dieplinhcami,True,False,False,0,3,35,0,1,0,0,0,0
"Hôm nay chính thức hết chai đầu tiên và khui chai thứ 2 🫶🏻
#Camiskincare #cami #skincareroutine #skincare ",2024-06-07 10:33:52,07/06/2024,False,https://www.tiktok.com/@dieplinhcami,nhạc nền - Cami,7377599476325927696,https://www.tiktok.com/@dieplinhcami/video/7377599447066217746,84,396,5,31000,67,9,"camiskincare, cami, skincareroutine, skincare",False,False,dieplinhcami,True,False,False,1,4,13,0,1,0,0,0,0
Tìm lại làn da sau những tháng ngày chiến đấu với mụn và thâm. Và đây là cách tui ăn gian một làn da căng bóng lúng liếng ngay tức thì 🤭 #cami #tiktok #skincare ,2024-06-06 09:40:49,06/06/2024,False,https://www.tiktok.com/@dieplinhcami,Harry,7250906153763277574,https://www.tiktok.com/@dieplinhcami/video/7377214681259232530,12,1325,12,107200,102,23,"cami, tiktok, skincare",False,False,dieplinhcami,True,False,False,1,3,31,0,1,0,0,0,0
2 món này tui rất ưng 🫶🏻 #cami #tiktok ,2024-06-01 12:36:24,01/06/2024,False,https://www.tiktok.com/@dieplinhcami,nhạc nền - Cami,7375404559780662032,https://www.tiktok.com/@dieplinhcami/video/7375404501911588114,25,156,0,13500,15,12,"cami, tiktok",False,False,dieplinhcami,True,False,False,1,2,6,0,0,1,0,0,1
Nghịch tóc #cami #tiktok #hair ,2024-05-31 11:57:06,31/05/2024,False,https://www.tiktok.com/@dieplinhcami,the boy is mine,7364494009253283856,https://www.tiktok.com/@dieplinhcami/video/7375023292039597320,30,2071,34,81200,101,25,"cami, tiktok, hair",False,False,dieplinhcami,True,False,False,0,3,2,0,1,0,0,0,0
"2 mẫu bra nhất định chúng mình phải có trong tủ đồ nhé! 
#Cami #tiktok 
Mua tại Camiforlady ạ ",2024-05-29 15:05:24,29/05/2024,False,https://www.tiktok.com/@dieplinhcami,Vlog ・ Stylish city pop(1275391),7200478944389564418,https://www.tiktok.com/@dieplinhcami/video/7374329647384759570,24,85,2,8843,21,0,"cami, tiktok",False,False,dieplinhcami,True,False,False,0,2,17,0,0,1,0,0,0
"Trả lời @Linh Úc Một câu hỏi tạo cho c rất nhiều cảm hứng, chỉ muốn ngồi lục lại clip các nơi để thành những mảnh ghép thanh xuân thật đẹp, nóng lòng muốn chia sẻ những khoảnh khắc này nên c vội vã lên clip luôn. Cảm ơn vì câu hỏi của em mà giúp c được ngắm lại cuộc sống của mình #cami #tiktok ",2024-05-28 18:30:42,28/05/2024,False,https://www.tiktok.com/@dieplinhcami,Vlog ・ Stylish city pop(1275391),7200478944389564418,https://www.tiktok.com/@dieplinhcami/video/7374011471262420242,63,340,2,16000,9,2,", cami, tiktok",False,False,dieplinhcami,True,False,False,0,2,64,0,0,0,1,0,0
"Nấu ăn tại nhà cũng là một trong những cách yêu thương bản thân 🫶🏻
Ăn cá rất tốt cho sức khoẻ, chị em một tuần bổ sung thêm cá vào bữa ăn nhé! #cami #tiktok #yeubepnghiennha ",2024-05-28 15:17:31,28/05/2024,False,https://www.tiktok.com/@dieplinhcami,Vlog ・ Stylish city pop(1275391),7200478944389564418,https://www.tiktok.com/@dieplinhcami/video/7373961674769911048,51,798,17,34200,121,6,"cami, tiktok, yeubepnghiennha",False,False,dieplinhcami,True,False,False,1,3,33,0,0,1,0,0,0
"Trả lời @Nguyễn Trâm  Cảm ơn các bạn đã theo dõi tui suốt bao năm tháng! Những món đồ skincare tui dùng đều có tại Cami nha các bạn iuuu!
Không phải dùng ngày 1 ngày 2 mà nói hay. Có những món tui dùng không kể số lượng nữa rồi 🤭 #cami #tiktok ",2024-05-27 18:25:40,27/05/2024,False,https://www.tiktok.com/@dieplinhcami,nhạc nền - Cami,7373639145132002065,https://www.tiktok.com/@dieplinhcami/video/7373639081449868552,69,1356,7,88100,269,39,", cami, tiktok",False,False,dieplinhcami,True,False,False,1,2,51,0,0,0,1,0,0
Skincare 2 bước trước khi đi bơi #cami #tiktok #skincare ,2024-05-27 09:26:57,27/05/2024,False,https://www.tiktok.com/@dieplinhcami,Peace,6798431900881913857,https://www.tiktok.com/@dieplinhcami/video/7373500248301276423,33,254,8,21000,43,8,"cami, tiktok, skincare",False,False,dieplinhcami,True,False,False,0,3,7,0,1,0,0,0,0
"#CapCut Một buổi chiều tuyệt vời của mình, xin được lan toả nó đến với các bạn ❣️ #cami #tiktok ",2024-05-26 19:13:31,26/05/2024,False,https://www.tiktok.com/@dieplinhcami,Vlog ・ Stylish city pop(1275391),7200478944389564418,https://www.tiktok.com/@dieplinhcami/video/7373280335930461447,52,279,0,12800,7,9,"capcut, cami, tiktok",False,False,dieplinhcami,True,False,False,1,3,17,0,0,0,1,0,1
Nên mặc set nào đi cafe cuối tuần các bác nhỉ !? 1 hay là 2 bây giờ #cami #tiktok ,2024-05-26 14:36:46,26/05/2024,False,https://www.tiktok.com/@dieplinhcami,Closer (feat. H.E.R.),7060685419460954113,https://www.tiktok.com/@dieplinhcami/video/7373209013711899911,21,109,1,8452,13,4,"cami, tiktok",False,False,dieplinhcami,True,False,False,0,2,18,0,0,1,0,0,1
Ai mang gió đến lay nhành hoa rơi. #cami #tiktok ,2024-05-24 20:58:33,24/05/2024,False,https://www.tiktok.com/@dieplinhcami,nhạc nền - Mây đi đâu đấy?,7297286413744868097,https://www.tiktok.com/@dieplinhcami/video/7372565234000645384,13,118,0,8507,4,2,"cami, tiktok",False,False,dieplinhcami,True,False,False,0,2,8,0,0,0,1,0,0
"Các bác có nghe thấy tiếng ve kêu không 🤭
Clip nãy up trong xe giờ up lại ngoài trời nè! #camiskincare #cami ",2024-05-24 15:50:44,24/05/2024,False,https://www.tiktok.com/@dieplinhcami,nhạc nền - Cami,7372485930038479617,https://www.tiktok.com/@dieplinhcami/video/7372485882667896065,26,375,4,23600,23,8,"camiskincare, cami",False,False,dieplinhcami,True,False,False,1,2,20,0,0,1,0,0,0
Trả lời @Hương nekkk Các bạn có thể mua tại page Cami (link đầu trang tiktok) nhaaa. Cặp đôi này tui dùng bao năm nay rồi ngon bổ rẻ ,2024-05-24 08:35:33,24/05/2024,False,https://www.tiktok.com/@dieplinhcami,nhạc nền - Cami,7372373785452350225,https://www.tiktok.com/@dieplinhcami/video/7372373594011110673,32,9135,198,408000,3148,150,,False,False,dieplinhcami,True,False,False,0,0,29,0,1,0,0,0,0
"Hình ảnh của tôi mỗi mùa mận chín, ngon cái miệng mà hại cái da 😂
Thứ không thể thiếu chấm mụnnnn. Làn da đỏng đảnh này ngoài sưng nóng nổi lên còn thi thoảng mẩn rôm như trẻ sơ sinh zậy đó 😹 #cami #tiktok #skincare ",2024-05-23 21:49:09,23/05/2024,False,https://www.tiktok.com/@dieplinhcami,Closer (feat. H.E.R.),7060685419460954113,https://www.tiktok.com/@dieplinhcami/video/7372207183825571090,7,1756,36,167800,341,47,"cami, tiktok, skincare",False,False,dieplinhcami,True,False,False,2,3,42,0,0,0,1,0,0
"Làn da đã ổn hơn 3 tháng trước dù vẫn nhạy cảm và còn vết thâm. Và đây là cách mình skincare sáng nhanh gọn vừa bảo vệ tối đa vừa đẹo tức thì 🫶🏻
#cami #tiktok #skincare ",2024-05-22 09:01:13,22/05/2024,False,https://www.tiktok.com/@dieplinhcami,nhạc nền - Cami,7371638235224738561,https://www.tiktok.com/@dieplinhcami/video/7371638194456005896,48,119,0,11200,8,5,"cami, tiktok, skincare",False,False,dieplinhcami,True,False,False,1,3,34,0,1,0,0,0,0
"#CapCut Rau củ quả, sữa chua là thứ không thể thiếu trong tủ lạnh của tuiii #cami #tiktok ",2024-05-20 19:34:37,20/05/2024,False,https://www.tiktok.com/@dieplinhcami,Vlog ・ Stylish city pop(1275391),7200478944389564418,https://www.tiktok.com/@dieplinhcami/video/7371059260165262600,30,926,7,35100,58,15,"capcut, cami, tiktok",False,False,dieplinhcami,True,False,False,0,3,15,0,0,0,1,0,0
"Nay tính không tập mà mặc set đồ tập mới lại có động lực tập liền ạ 
Các bác thích set nào hơn!? ",2024-05-20 16:36:23,20/05/2024,False,https://www.tiktok.com/@dieplinhcami,espresso sabrina carpenter sped up,7357020878051183366,https://www.tiktok.com/@dieplinhcami/video/7371013325552979207,11,1030,22,36800,115,17,,False,False,dieplinhcami,True,False,False,0,0,23,0,0,1,0,0,0
Các bạn muốn mình chia sẻ về điều gì?! Coment mình biết nhé 😉 #cami #titok ,2024-05-19 10:20:14,19/05/2024,False,https://www.tiktok.com/@dieplinhcami,Vlog ・ Stylish city pop(1275391),7200478944389564418,https://www.tiktok.com/@dieplinhcami/video/7370545309006433554,33,545,0,19800,18,10,"cami, titok",False,False,dieplinhcami,True,False,False,1,2,13,0,1,0,0,0,1
Tóc thơm tức thì nhờ em bộ gội xả này #DaugoiEnchanteur #Nhuhoatrentoc #SuperBrandDay #WiproSieuSaleHe #cami #tiktok ,2024-05-18 19:28:45,18/05/2024,False,https://www.tiktok.com/@dieplinhcami,Vlog ・ Stylish city pop(1275391),7200478944389564418,https://www.tiktok.com/@dieplinhcami/video/7370315568034942225,54,111,9,11900,15,2,"daugoienchanteur, nhuhoatrentoc, superbrandday, wiprosieusalehe, cami, tiktok",False,False,dieplinhcami,True,False,True,0,6,10,0,0,0,1,0,1
"Mọi người có thích hoa hướng dương không !?
🌻 Vườn hoa hướng dương Eco #cami #tiktok ",2024-05-16 15:22:47,16/05/2024,False,https://www.tiktok.com/@dieplinhcami,Vlog ・ Stylish city pop(1275391),7200478944389564418,https://www.tiktok.com/@dieplinhcami/video/7369510014597270791,35,123,0,8317,5,9,"cami, tiktok",False,False,dieplinhcami,True,False,False,1,2,14,0,0,1,0,0,0
"Pink Girl 🦩 
Xinh hem các bác #Camiforlady #tiktok ",2024-05-14 12:38:48,14/05/2024,False,https://www.tiktok.com/@dieplinhcami,magnetic rnb ver.,7353888325805804294,https://www.tiktok.com/@dieplinhcami/video/7368725592692329746,22,3909,75,136200,686,51,"camiforlady, tiktok",False,False,dieplinhcami,True,False,False,1,2,6,0,0,1,0,0,0
"Hôm nay mặc gì nhỉ 😎
Full set ig Camiforlady ạ ",2024-05-14 11:57:56,14/05/2024,False,https://www.tiktok.com/@dieplinhcami,nhạc nền - Cami,7368715095881124625,https://www.tiktok.com/@dieplinhcami/video/7368715064003595538,43,154,2,11200,16,8,,False,False,dieplinhcami,True,False,False,1,0,10,0,1,0,0,0,0
"Từ bánh bèo hoa lá hoá năng động trẻ trung 😎
Các bạn thích trước hay sau #cami #tiktok #camiforlady ",2024-05-11 12:21:23,11/05/2024,False,https://www.tiktok.com/@dieplinhcami,loveable,7109005930381708059,https://www.tiktok.com/@dieplinhcami/video/7367607847103778056,14,1029,14,65400,109,20,"cami, tiktok, camiforlady",False,False,dieplinhcami,True,False,False,1,3,16,0,0,1,0,0,1
"Tâm hồn cũng cần được LÀM SẠCH, DƯỠNG VÀ BẢO VỆ đó 🥰
#cami #tiktok Mong rằng chiếc clip bày sẽ lan toả được điều tích cực đến các bạn nhé!",2024-05-08 12:00:39,08/05/2024,False,https://www.tiktok.com/@dieplinhcami,Vlog ・ Stylish city pop(1275391),7200478944389564418,https://www.tiktok.com/@dieplinhcami/video/7366489245277572359,81,243,2,9101,18,3,"cami, tiktok",False,False,dieplinhcami,True,False,False,1,2,28,0,0,1,0,0,0
"Tip chăm tóc bồng bềnh, da đầu khoẻ mạnh #50Megumi #NganNguaTocRungNgayTuSom #DuongDaDau #goclamdep #reviewlamdep #beautytok #cami #tiktok ",2024-05-08 10:39:44,08/05/2024,True,https://www.tiktok.com/@dieplinhcami,nhạc nền - Cami,7366468431010564881,https://www.tiktok.com/@dieplinhcami/video/7366468373095386384,57,384,7,143800,29,5,"50megumi, ngannguatocrungngaytusom, duongdadau, goclamdep, reviewlamdep, beautytok, cami, tiktok",False,False,dieplinhcami,True,False,False,0,8,9,0,1,0,0,0,0
"Kết thúc bài tập và hoàng hôn ghé tận nhà hôn lên má 🫶🏻
Xin phép lan toả sự đáng yêu này đến các bạn ✨. Các bạn hôm nay đã tập chưa!? ",2024-05-06 17:45:24,06/05/2024,False,https://www.tiktok.com/@dieplinhcami,Harry,7250906153763277574,https://www.tiktok.com/@dieplinhcami/video/7365835899453656337,6,210,1,12000,6,6,,False,False,dieplinhcami,True,False,False,2,0,32,0,0,1,0,0,0
#CapCut Giờ chỉ thích mấy mẫu quần chiều dài vừa tầm để thoải mái chạy nhảy không lo hở. Hè này tui không thể sống thiếu quần short 😎 #cami #tiktok #camiforlady ,2024-05-06 14:01:05,06/05/2024,False,https://www.tiktok.com/@dieplinhcami,Vlog ・ Stylish city pop(1275391),7200478944389564418,https://www.tiktok.com/@dieplinhcami/video/7365778106885410055,17,1784,18,80200,231,20,"capcut, cami, tiktok, camiforlady",False,False,dieplinhcami,True,False,True,1,4,27,0,0,1,0,0,0
#CapCut Các bạn nghĩ sao về quan điểm này ạ 😉 #Cami #tiktok #skincareroutine ,2024-05-05 11:01:34,05/05/2024,False,https://www.tiktok.com/@dieplinhcami,nhạc nền - Cami,7365360799944084225,https://www.tiktok.com/@dieplinhcami/video/7365360767861935367,50,133,0,10100,5,6,"capcut, cami, tiktok, skincareroutine",False,False,dieplinhcami,True,False,True,1,4,9,0,1,0,0,0,1
Hôm nay rực rỡ quá 💋 #tiktok #cami ,2024-05-05 08:24:49,05/05/2024,False,https://www.tiktok.com/@dieplinhcami,original sound,7344051138909637422,https://www.tiktok.com/@dieplinhcami/video/7365320366077562119,6,352,6,12700,25,10,"tiktok, cami",False,False,dieplinhcami,True,False,False,1,2,5,0,1,0,0,0,1
"Bha nền nước + gel Aqua + Oil 
Da mọng mềm phê cực ý! (Bha nền nước tuần mình dùng 2-3 lần thôi ) #camiskincare #cami ",2024-05-05 08:02:04,05/05/2024,False,https://www.tiktok.com/@dieplinhcami,nhạc nền - Cami,7365314556198963969,https://www.tiktok.com/@dieplinhcami/video/7365314483251580161,37,2398,16,81100,213,36,"camiskincare, cami",False,False,dieplinhcami,True,False,False,0,2,24,0,1,0,0,0,1
So sánh 2 dòng kem chống nắng D’Alba #camiskincare #cami #dalba#dalbavn#dalbavietnam,2024-05-04 18:49:00,04/05/2024,False,https://www.tiktok.com/@dieplinhcami,nhạc nền - Cami,7365110198522530576,https://www.tiktok.com/@dieplinhcami/video/7365110125117426960,66,381,10,42100,32,10,"camiskincare, cami, dalba, dalbavn, dalbavietnam",False,False,dieplinhcami,True,False,False,0,5,8,0,0,0,1,0,1
"Một chút động lực chăm da của tui 🫶🏻
Lan toả lan toả ạ #camiskincare #cami",2024-05-02 07:55:15,02/05/2024,False,https://www.tiktok.com/@dieplinhcami,After Rain,7355529959026984977,https://www.tiktok.com/@dieplinhcami/video/7364199433812184321,0,160,3,19200,17,9,"camiskincare, cami",True,False,dieplinhcami,True,False,False,1,2,13,0,1,0,0,0,0
Nghỉ lễ thì làm gì? Tui làm đẹp nha các bạn #cami #tiktok ,2024-04-29 09:42:50,29/04/2024,False,https://www.tiktok.com/@dieplinhcami,蜜桃物语,7123789566997252127,https://www.tiktok.com/@dieplinhcami/video/7363113955587411218,15,363,1,25100,15,16,"cami, tiktok",False,False,dieplinhcami,True,False,True,0,2,11,0,1,0,0,0,0
"Những điều mình làm ngay sau khi đi năng về 
Kiếp sau nếu được chọn, vẫn chọn là phụ nữ ạ ❣️ 
#cami #tiktok ",2024-04-28 17:19:01,28/04/2024,False,https://www.tiktok.com/@dieplinhcami,Vlog ・ Stylish city pop(1275391),7200478944389564418,https://www.tiktok.com/@dieplinhcami/video/7362860431901314322,56,138,1,11400,5,6,"cami, tiktok",False,False,dieplinhcami,True,False,False,1,2,22,0,0,1,0,0,1
"Hế lô các chị em
Tính dùng thêm mới khoe mà đã có bạn nhắn tin đặt hàng rùi nên tui sẽ lên review luôn! 

Nếu để nói serum phục hồi hay mờ thâm cần thời gian để cảm nhận và phát huy tác dụng ít phải 3-5 tháng mới thấy thay đổi thì dòng chứa HA lại cần ít thời gian hơn! 
Thật ra chỉ cần dùng trên dưới chục lần là đã biết dòng đó có cấp nước đủ cho da hay không bởi da sẽ phát tín hiệu liền như: 
- Không bị tiết dầu nhiều
- Da căng ấn vào cảm giác mọng 
- Kết hợp với cushion sẽ giúp giữ ẩm và mọng hơn
- Giúp da sáng trong và có sức sống hơn
Và đây là dòng HA mình dùng! GEL HA 
✔️ Về mùi: mình không thích lắm, hơi hắc nhẹ 
✔️ Về chất; trắng trong như bột củ sen, cơ độ sệt nhẹ không đặc cũng không quá lỏng 
✔️Cảm nhận trên da: khi massage gel bắt đầu tan ra dần thành dạng nước thấm vào da sau đó để lại cảm giác mềm ẩm mọng, làm dịu những vết đỏ trên da nhanh chóng đặc biệt với đứa da nhạy cảm dễ đỏ sau khi rửa mặt như mình. Thấm nhanh, không gây cảm giác vón, nhờn dính phía sau, gần như không có cảm giác đã thoa phẩm nhưng trên da lại thấy mọng và căng hơn! 
✔️ Sáng dậy mình chỉ kết hợp Gel HA cùng cushion và kết quả cuối ngày da giảm lượng dầu hơn mọi ngày chứng tỏ sản phẩm giữ nước cân bằng ẩm trên da khá tốt 
✔️ Bật mí với các bạn mình đi soi da và có những “nếp nhăn mất nước trên da” nên phải tích cực bổ sung HA để xử lý tình trạng đó
✔️ HA thì không ai là không biết đến rồi nhưng gel HA thì nên thử một lần và da nào cũng cần đặc biệt da dầu dễ mất nước như tui nha 
🍃 Tui sẽ kiên trì dùng và đi soi da lại sau đó sẽ cập nhật tình hình cho các bạn nha 
🍃 Dù gì cũng phải công nhận gel HA + cushion là cặp đôi quá ngonnnnn, da mình livestream với mọi người từ sáng tới giờ dùng nguyên cặp đó nè 
Ai mà đọc được review này thì cmt cho tui biết nha 🤭",2024-04-26 17:33:52,26/04/2024,False,https://www.tiktok.com/@dieplinhcami,nhạc nền - Cami,7362122135591979793,https://www.tiktok.com/@dieplinhcami/video/7362122075517029640,57,755,4,48400,127,20,,False,False,dieplinhcami,True,False,False,9,0,411,0,0,1,0,0,0
#CapCut Tip sấy tóc xoăn của mình 😉 #cami #tiktok ,2024-04-26 16:12:44,26/04/2024,False,https://www.tiktok.com/@dieplinhcami,Vlog ・ Stylish city pop(1275391),7200478944389564418,https://www.tiktok.com/@dieplinhcami/video/7362101179439959314,47,1287,16,100700,120,31,"capcut, cami, tiktok",False,False,dieplinhcami,True,False,False,1,3,6,0,0,1,0,0,0
"#CapCut Có cùng gu với ai ở đây không ạ !? #tiktok #cami #Camiforlady
Tất cả đồ mình mua tại IG/F.B Camiforlady ",2024-04-24 14:29:02,24/04/2024,False,https://www.tiktok.com/@dieplinhcami,Glowing Sea,7135837880609409025,https://www.tiktok.com/@dieplinhcami/video/7361332288493194504,71,1792,19,104300,306,36,"capcut, tiktok, cami, camiforlady",False,False,dieplinhcami,True,False,False,0,4,18,0,0,1,0,0,0
Nay bánh bèo nhập vai ạ 🤭 #tiktok #cami ,2024-04-24 12:25:43,24/04/2024,False,https://www.tiktok.com/@dieplinhcami,Moonlight Romance.,6983586034592336666,https://www.tiktok.com/@dieplinhcami/video/7361300507350125832,8,213,1,13100,17,15,"tiktok, cami",False,False,dieplinhcami,True,False,False,1,2,6,0,0,1,0,0,0
