text,createTime,createTimeISO,isAd,profileUrl,musicName,musicId,webVideoUrl,duration,diggCount,shareCount,playCount,collectCount,commentCount,hashtags,isSlideshow,isSponsored,kol_username,ttSeller,commerceUser,is_trending,emoji_count,hashtag_count,word_count_no_emoji_hashtag,early_morning,morning,afternoon,evening,late_night,is_weekend
Hôm nay tui bị lừa một chút nhẹ 🤭 #dieplamanh #trangphap #huyenbaby #ninhduonglanngoc #khongtuquynh #quynhnga #lunas ,2024-08-22 20:02:36,22/08/2024,True,https://www.tiktok.com/@dieplamanh,nhạc nền - Diệp Lâm Anh,7405948619583671057,https://www.tiktok.com/@dieplamanh/video/7405948466695802113,59,11500,197,209100,597,132,"dieplamanh, trangphap, huyenbaby, ninhduonglanngoc, khongtuquynh, quynhnga, lunas",False,False,dieplamanh,False,False,False,1,7,8,0,0,0,1,0,0
Mấy mẹ con quậy banh cái showroom lên 😆 #dieplamanh #boorin #bboy ,2024-08-20 19:51:51,20/08/2024,True,https://www.tiktok.com/@dieplamanh,Asuka,6782726128881633281,https://www.tiktok.com/@dieplamanh/video/7405203523417230608,142,38300,209,1100000,1141,293,"dieplamanh, boorin, bboy",False,False,dieplamanh,False,False,False,1,3,8,0,0,0,1,0,0
Nhật ký chay ngày thứ 11 của bạn Cún 🩵🩵🩵 #dieplamanh ,2024-08-13 20:41:55,13/08/2024,False,https://www.tiktok.com/@dieplamanh,Water,7260736046344882177,https://www.tiktok.com/@dieplamanh/video/7402618816661966097,23,76500,512,1900000,2072,384,dieplamanh,False,False,dieplamanh,False,False,False,1,1,9,0,0,0,1,0,0
Đốt cháy năng lượng ❤️‍🔥 Nhật ký ăn chay ngày 3 🌱 #dieplamanh #khavu #dance #freestyle #hiphop #tiktokgiaitri @Kha Vũ ,2024-08-06 01:04:13,05/08/2024,False,https://www.tiktok.com/@dieplamanh,Best Friend (feat. Doja Cat),6901529746388027394,https://www.tiktok.com/@dieplamanh/video/7399717741705448720,51,29000,190,758900,1035,194,"dieplamanh, khavu, dance, freestyle, hiphop, tiktokgiaitri, ",False,False,dieplamanh,False,False,False,3,6,13,1,0,0,0,0,0
"Sau khi bơi 05 vòng, lên nhà nhảy 08 bài. Và bài này được 02 vote bởi chị em chui 🤣 - Một ngày dành cho thể thao ❤️@Kha Vũ #dieplamanh #khavu #dance #dancechallenge #hiphop #freestyle #tiktokgiatri #xuhuong ",2024-08-06 00:36:48,05/08/2024,False,https://www.tiktok.com/@dieplamanh,nhạc nền - Diệp Lâm Anh,7399710722726955777,https://www.tiktok.com/@dieplamanh/video/7399710663225920784,68,3672,97,139100,209,102,", dieplamanh, khavu, dance, dancechallenge, hiphop, freestyle, tiktokgiatri, xuhuong",False,False,dieplamanh,False,False,False,2,8,29,1,0,0,0,0,0
Cún đi dự Grand Opening Lynh Premium của chị Lê Linh. Gặp em Gấu sau bao ngày nhớ ơi là nhớ! #dieplamanh #lelinh #kyduyen #thuyngan #hoangoanh #lynhpremium #grandopening ,2024-08-03 18:11:52,03/08/2024,False,https://www.tiktok.com/@dieplamanh,Woman,6976278887063898114,https://www.tiktok.com/@dieplamanh/video/7398869323114122512,91,5644,74,349100,237,124,"dieplamanh, lelinh, kyduyen, thuyngan, hoangoanh, lynhpremium, grandopening",False,False,dieplamanh,False,False,True,0,7,21,0,0,0,1,0,1
Bốc trúng thẻ của tui mà chị tui vẫn không cho cà :))) Chị yêu chiều hơn cả người yêu 😆😆😆 #dieplamanh #vickylamcuc #thammyvienadora #adora @VICKY LAMCUC (Daily) ,2024-08-01 19:45:37,01/08/2024,False,https://www.tiktok.com/@dieplamanh,nhạc nền - Diệp Lâm Anh,7398151356076329744,https://www.tiktok.com/@dieplamanh/video/7398151310522027265,162,81200,658,2200000,1638,206,"dieplamanh, vickylamcuc, thammyvienadora, adora, ",False,False,dieplamanh,False,False,False,1,4,23,0,0,0,1,0,0
Chào em cô gái tháng 8 🦁 #dieplamamh #leo ,2024-08-01 06:50:16,31/07/2024,False,https://www.tiktok.com/@dieplamanh,Water,7260736046344882177,https://www.tiktok.com/@dieplamanh/video/7397951448119594257,42,6111,115,249600,279,100,"dieplamamh, leo",False,False,dieplamanh,False,False,False,1,2,6,0,1,0,0,0,0
"Rehearsal thì kiểu này, mà gặp các em dancers cái quên cả bài 😆 #dieplamanh #dance #streetwomanfighter #swf #bgirl ",2024-07-28 13:25:34,28/07/2024,False,https://www.tiktok.com/@dieplamanh,nhạc nền - Diệp Lâm Anh,7396569068305664785,https://www.tiktok.com/@dieplamanh/video/7396569021715434769,44,66500,392,2000000,1386,260,"dieplamanh, dance, streetwomanfighter, swf, bgirl",False,False,dieplamanh,False,False,True,1,5,13,0,0,1,0,0,1
Họp báo công bố phát sóng STREET WOMAN FIGHTER VIETNAM ❤️‍🔥 #dieplamanh #streetwomanfighter #swfvn #nuhoangvudaoduongpho #tiktokgiaitri ,2024-07-18 13:15:14,18/07/2024,False,https://www.tiktok.com/@dieplamanh,Rockstar,7385289879897622544,https://www.tiktok.com/@dieplamanh/video/7392855486162324753,60,6680,77,338300,273,97,"dieplamanh, streetwomanfighter, swfvn, nuhoangvudaoduongpho, tiktokgiaitri",False,False,dieplamanh,False,False,True,2,5,11,0,0,1,0,0,0
Hôm nay Cún gặp được CunCun Hanoi rồi…Bất ngờ vì các em tới gặp Cún đông vui như thế! Tưng bùng cả buổi trưa nay. Yêu cả nhà CunCun Team nhiềuuuu 💜💜💜 #dieplamanh #fcdieplamanh #cuncunteam #cuncunhanoi #hanoi ,2024-07-14 15:14:39,14/07/2024,False,https://www.tiktok.com/@dieplamanh,Đừng Làm Trái Tim Anh Đau,7376201443362342928,https://www.tiktok.com/@dieplamanh/video/7391401927399017744,35,22000,155,632900,768,204,"dieplamanh, fcdieplamanh, cuncunteam, cuncunhanoi, hanoi",False,False,dieplamanh,False,False,False,1,5,31,0,0,1,0,0,1
Ngoài những lúc ke đầu và hít đất ra… #dieplamanh ,2024-07-11 19:57:28,11/07/2024,False,https://www.tiktok.com/@dieplamanh,nhạc nền - Diệp Lâm Anh,7390361611216702209,https://www.tiktok.com/@dieplamanh/video/7390361571052113169,46,7712,208,244500,455,209,dieplamanh,False,False,dieplamanh,False,False,False,0,1,9,0,0,0,1,0,0
Street Woman Fighter Vietnam 💥Coming soon 🔥 #dieplamanh #streetwomanfighter #nuhoangvudaoduongpho ,2024-07-08 22:26:20,08/07/2024,False,https://www.tiktok.com/@dieplamanh,nhạc nền - Diệp Lâm Anh,7389286740864912144,https://www.tiktok.com/@dieplamanh/video/7389286692873719048,17,4596,24,260300,215,95,"dieplamanh, streetwomanfighter, nuhoangvudaoduongpho",False,False,dieplamanh,False,False,True,2,3,6,0,0,0,0,1,0
Mua nước hoa chỉ để bày hoy. Cún chỉ dùng có 2 chai chân ái đó giờ mà lượn lờ ở sân bay nhìn mấy chai vừa xinh vừa thơm không đỡ được. Hốt 20 chục chai về review thử coi có thể tìm được chân ái mới hem nào. ,2024-07-03 23:18:35,03/07/2024,False,https://www.tiktok.com/@dieplamanh,nhạc nền - Diệp Lâm Anh,7387444778629122833,https://www.tiktok.com/@dieplamanh/video/7387444727164980498,188,22000,336,809100,1654,239,,False,False,dieplamanh,False,False,False,0,0,50,0,0,0,0,1,0
Try not to dance 🤣 #dieplamanh #khavu #trannham #tiktokgiaitri @Kha Vũ @realtrannham97 ,2024-07-03 01:39:45,02/07/2024,False,https://www.tiktok.com/@dieplamanh,original sound,6875654974211115781,https://www.tiktok.com/@dieplamanh/video/7387110008846175506,58,23200,204,946000,892,179,"dieplamanh, khavu, trannham, tiktokgiaitri, , ",False,False,dieplamanh,False,False,False,1,4,7,1,0,0,0,0,0
Lúc không nhây thì cũng đẹp gái 🤭,2024-07-02 23:22:14,02/07/2024,False,https://www.tiktok.com/@dieplamanh,Bồ Công Anh,7350263253819574273,https://www.tiktok.com/@dieplamanh/video/7387074585616780552,24,5459,100,141800,293,137,,False,False,dieplamanh,False,False,False,1,0,7,0,0,0,0,1,0
Ready? Fight 💥🥊 #dieplamanh #streetwomanfighter #dance #realityshow #tiktokgiaitri ,2024-06-29 14:03:22,29/06/2024,True,https://www.tiktok.com/@dieplamanh,nhạc nền - Diệp Lâm Anh,7385817354019556112,https://www.tiktok.com/@dieplamanh/video/7385817315805252882,47,5391,130,282400,294,93,"dieplamanh, streetwomanfighter, dance, realityshow, tiktokgiaitri",False,False,dieplamanh,False,False,True,1,5,2,0,0,1,0,0,1
My back 😂,2024-06-28 23:18:45,28/06/2024,False,https://www.tiktok.com/@dieplamanh,magnetic rnb ver.,7353888325805804294,https://www.tiktok.com/@dieplamanh/video/7385589344704253191,22,9880,88,252200,484,174,,False,False,dieplamanh,False,False,False,1,0,2,0,0,0,0,1,0
Khó chịu vô cùng :)))) @Pông Chuẩn #dieplamanh #pongchuan #lunas #moonlight #dance #tiktokgiaitri ,2024-06-28 19:01:40,28/06/2024,False,https://www.tiktok.com/@dieplamanh,MOONLIGHT,7369840445692282896,https://www.tiktok.com/@dieplamanh/video/7385523099430620424,34,28300,108,685300,900,227,", dieplamanh, pongchuan, lunas, moonlight, dance, tiktokgiaitri",False,False,dieplamanh,False,False,False,0,6,7,0,0,0,1,0,0
Chắc là flop nhưng hôm nay làm Sói hoang hư hỏng đi 😎 #dieplamanh #lethanhhoa #nyx #lunas ,2024-06-24 18:04:07,24/06/2024,False,https://www.tiktok.com/@dieplamanh,nhạc nền - Diệp Lâm Anh,7384023954345773840,https://www.tiktok.com/@dieplamanh/video/7384023899970866449,54,10400,169,228000,436,192,"dieplamanh, lethanhhoa, nyx, lunas",False,False,dieplamanh,False,False,True,1,4,12,0,0,0,1,0,0
PRESS CHOICE AWARD 🍎 Đầm xinh của anh @Đỗ Long #dieplamanh #tiktokgiaitri #hautruong #sukien #dolong ,2024-06-23 19:41:01,23/06/2024,False,https://www.tiktok.com/@dieplamanh,Vườn Địa Đàng,7292381915368245249,https://www.tiktok.com/@dieplamanh/video/7383677802962226449,54,9581,146,225500,402,102,", dieplamanh, tiktokgiaitri, hautruong, sukien, dolong",False,False,dieplamanh,False,False,False,1,5,9,0,0,0,1,0,1
Sao cái đầu to ra nhìn đùn thế nhỉ :))) #dieplamanh #lunas #moonlight #tytydapgioresong #ridethewind #chidepdapgioresong #tiktokgiaitri ,2024-06-23 17:27:41,23/06/2024,False,https://www.tiktok.com/@dieplamanh,nhạc nền - Diệp Lâm Anh,7383643476744784656,https://www.tiktok.com/@dieplamanh/video/7383643435342761233,37,20500,57,432800,676,131,"dieplamanh, lunas, moonlight, tytydapgioresong, ridethewind, chidepdapgioresong, tiktokgiaitri",False,False,dieplamanh,False,False,True,0,7,10,0,0,1,0,0,1
Các chị em LUNAS giao lưu ở Đạp Gió 2024 😝 #dieplamanh #ninhduonglanngoc #trangphap #huyenbaby #khongtuquynh #lunas #chidepdapgioresong #chidep #dapgio #tytydapgioresong #tiktokgiaitri ,2024-06-22 16:21:07,22/06/2024,False,https://www.tiktok.com/@dieplamanh,MOONLIGHT,7369840445692282896,https://www.tiktok.com/@dieplamanh/video/7383255193879891201,165,37700,164,471800,1257,169,"dieplamanh, ninhduonglanngoc, trangphap, huyenbaby, khongtuquynh, lunas, chidepdapgioresong, chidep, dapgio, tytydapgioresong, tiktokgiaitri",False,False,dieplamanh,False,False,True,1,11,10,0,0,1,0,0,1
"HipHop Never Die, Diệp Lâm Anh Never Sai 😎 #DiepLamAnh #LUNAS #MOONLIGHT #NYX #dapgio2024 #chidep2024",2024-06-22 11:32:19,22/06/2024,False,https://www.tiktok.com/@dieplamanh,MOONLIGHT,7369840445692282896,https://www.tiktok.com/@dieplamanh/video/7383180770124352785,30,33600,139,482400,804,241,"dieplamanh, lunas, moonlight, nyx, dapgio2024, chidep2024",False,False,dieplamanh,False,False,True,1,6,8,0,1,0,0,0,1
Bạn tặng quà sinh nhật trước có 2 tháng thôi chứ không bao nhiêu hết 😅 Tặng cọng dây chuyền xong bạn đòi đi mua bông tai luôn :))) Top chiều bạn gọi tên @Đàm Thu Trang #dieplamanh #vancleef ,2024-06-21 13:22:46,21/06/2024,False,https://www.tiktok.com/@dieplamanh,Morsmordre（莫斯莫多）,6881996450729822215,https://www.tiktok.com/@dieplamanh/video/7382838141406825744,166,42600,690,1000000,1048,166,", dieplamanh, vancleef",False,False,dieplamanh,False,False,False,1,2,36,0,0,1,0,0,0
Đẹp vô cùng tận luôn ớ 😝 #dieplamanh #nyx #xinhbagai ,2024-06-20 20:59:37,20/06/2024,False,https://www.tiktok.com/@dieplamanh,nhạc nền - Diệp Lâm Anh,7382584836315581185,https://www.tiktok.com/@dieplamanh/video/7382584796809006353,24,4642,107,99100,236,118,"dieplamanh, nyx, xinhbagai",False,False,dieplamanh,False,False,False,1,3,6,0,0,0,1,0,0
Ngầu lòi 😎😎😎 #DiepLamAnh #LUNAS #NYX #MOONLIGHT #dapgio2024 ,2024-06-20 10:20:57,20/06/2024,False,https://www.tiktok.com/@dieplamanh,nhạc nền - GiaMinhhh cầu lông🤞,7360706996389432081,https://www.tiktok.com/@dieplamanh/video/7382420189482142993,18,6261,51,98700,293,185,"dieplamanh, lunas, nyx, moonlight, dapgio2024",False,False,dieplamanh,False,False,True,1,5,2,0,1,0,0,0,0
Ghiền mấy cái đồ xinh xinh này ghê 💗 #dieplamanh #unbox #makeupbox #flowerknows #makeup ,2024-06-19 12:34:38,19/06/2024,False,https://www.tiktok.com/@dieplamanh,La vie en rose (Cover Edith Piaf),7095736264514717732,https://www.tiktok.com/@dieplamanh/video/7382083556685778192,130,70600,1713,1700000,2072,429,"dieplamanh, unbox, makeupbox, flowerknows, makeup",False,False,dieplamanh,False,False,False,1,5,8,0,0,1,0,0,0
Câu chuyện 🐶🐥 #dieplamanh ,2024-06-16 22:42:14,16/06/2024,False,https://www.tiktok.com/@dieplamanh,nhạc nền - Diệp Lâm Anh,7381126934761147137,https://www.tiktok.com/@dieplamanh/video/7381126890309913872,28,84900,341,1500000,1438,493,dieplamanh,False,False,dieplamanh,False,False,False,1,1,2,0,0,0,0,1,1
Đá bóng ihhhh 🤭 ,2024-06-13 23:12:40,13/06/2024,False,https://www.tiktok.com/@dieplamanh,Anh Chẳng Thoát Được Đâu (Lover Hunter),7368727143759251457,https://www.tiktok.com/@dieplamanh/video/7380021408413322513,44,13500,61,519600,355,99,,False,False,dieplamanh,False,False,True,1,0,3,0,0,0,0,1,0
Layout Cún đi chụp hình hum nai 💛 #dieplamanh #photoshoot #cosmetics #chamsocda #makeup #hairstyle #fyp ,2024-06-12 15:28:27,12/06/2024,False,https://www.tiktok.com/@dieplamanh,Finding You,7369516593862920209,https://www.tiktok.com/@dieplamanh/video/7379530763319921921,33,30600,339,572100,923,368,"dieplamanh, photoshoot, cosmetics, chamsocda, makeup, hairstyle, fyp",False,False,dieplamanh,False,False,False,1,7,7,0,0,1,0,0,0
Cún góp mặt trong workshop đầu tiên của Đỗ Long Academy. Khoá học và chia sẻ về nhiều kinh nghiệm trong  cuộc sống và công việc để tất cả chúng ta giúp nhau vững vàng hơn! 🧡 #dieplamanh #dolong ,2024-06-10 19:58:24,10/06/2024,False,https://www.tiktok.com/@dieplamanh,nhạc nền - Diệp Lâm Anh,7378863366728731393,https://www.tiktok.com/@dieplamanh/video/7378858170619333905,47,13300,160,272600,518,203,"dieplamanh, dolong",False,False,dieplamanh,False,False,False,1,2,36,0,0,0,1,0,0
Nữ thần bóng đêm làm bạn với bóng tối 🤭 #dieplamanh #nyx Stylist @Pông Chuẩn antifan thật sự nhiệt huyết :)))),2024-06-08 20:11:29,08/06/2024,False,https://www.tiktok.com/@dieplamanh,nhạc nền - Diệp Lâm Anh,7378119410260757265,https://www.tiktok.com/@dieplamanh/video/7378119362596703505,40,4742,103,88900,225,106,"dieplamanh, nyx, ",False,False,dieplamanh,False,False,False,1,2,18,0,0,0,1,0,1
Không quậy đời không nể 😂,2024-06-03 14:48:02,03/06/2024,False,https://www.tiktok.com/@dieplamanh,nhạc nền - Diệp Lâm Anh,7376180631451028240,https://www.tiktok.com/@dieplamanh/video/7376180576421809424,27,31300,136,749300,736,297,,False,False,dieplamanh,False,False,False,1,0,5,0,0,1,0,0,0
Đội trưởng Cún Đùn đấm quả bóng trầy tay gần 1 tháng chưa lành 😂 ,2024-06-02 23:16:58,02/06/2024,False,https://www.tiktok.com/@dieplamanh,nhạc nền - Diệp Lâm Anh,7375940700103281424,https://www.tiktok.com/@dieplamanh/video/7375940657015196929,58,6050,30,205300,248,73,,False,False,dieplamanh,False,False,False,1,0,14,0,0,0,0,1,1
Chúng tôi và tình yêu với bóng…💚 #chipu #dieplamanh #crisphan #tuantran #tuanhung #ngocphuoc #tiktokgiaitri #gameshow ,2024-05-28 20:21:18,28/05/2024,False,https://www.tiktok.com/@dieplamanh,Mamma Mia,7094788114681432066,https://www.tiktok.com/@dieplamanh/video/7374039959109455121,35,12500,32,461900,209,67,"chipu, dieplamanh, crisphan, tuantran, tuanhung, ngocphuoc, tiktokgiaitri, gameshow",False,False,dieplamanh,False,False,True,1,8,7,0,0,0,1,0,0
Nghịch thật chứ 💚 #chipu #dieplamanh #crisphan #tuantran #tuanhung #tiktokgiaitri #dancechallenge  ,2024-05-28 16:35:36,28/05/2024,False,https://www.tiktok.com/@dieplamanh,Cứ nói Yêu lần Này Remix,7290126021339253505,https://www.tiktok.com/@dieplamanh/video/7373981803561897232,14,47300,251,1600000,1107,297,"chipu, dieplamanh, crisphan, tuantran, tuanhung, tiktokgiaitri, dancechallenge",False,False,dieplamanh,False,False,False,1,7,3,0,0,1,0,0,0
“Mùn Lái” phiên bản GIAI NHÂN 🤭 ##MOONLIGHT #LUNAS #SOL #dieplamanh #huyenbaby #khanhvy #pongchuan #tiktokgiaitri #dancechallenge #moonlightdance #gianhan #dolong ,2024-05-28 12:43:48,28/05/2024,False,https://www.tiktok.com/@dieplamanh,MOONLIGHT,7369840445692282896,https://www.tiktok.com/@dieplamanh/video/7373922056099892497,73,9235,21,225500,292,48,"moonlight, lunas, sol, dieplamanh, huyenbaby, khanhvy, pongchuan, tiktokgiaitri, dancechallenge, moonlightdance, gianhan, dolong",False,False,dieplamanh,False,False,True,1,12,7,0,0,1,0,0,0
Kiểu này thì chị em chúng tôi cứ khoẻ đẹp mãi thôiiii 🫶🏻  #FamiGreenSoy #KhoeDepTramPhan #dieplamanh #ninhduonglanngoc #trangphap #huyenbaby #khongtuquynh #lunas ,2024-05-27 22:15:03,27/05/2024,True,https://www.tiktok.com/@dieplamanh,MOONLIGHT,7369840445692282896,https://www.tiktok.com/@dieplamanh/video/7373698198348533010,128,7006,86,862900,307,82,"famigreensoy, khoedeptramphan, dieplamanh, ninhduonglanngoc, trangphap, huyenbaby, khongtuquynh, lunas",False,False,dieplamanh,False,False,False,1,8,12,0,0,0,0,1,0
Cháy phố 🔥 #MOONLIGHT #LUNAS #SOL #dieplamanh #tiktokgiaitri #moonlightdance #dancechallenge #fyp ,2024-05-27 21:10:08,27/05/2024,False,https://www.tiktok.com/@dieplamanh,BEN 10,7335380242099440386,https://www.tiktok.com/@dieplamanh/video/7373681454435323137,48,10200,65,194400,414,131,"moonlight, lunas, sol, dieplamanh, tiktokgiaitri, moonlightdance, dancechallenge, fyp",False,False,dieplamanh,False,False,True,1,8,2,0,0,0,1,0,0
Tấu hề cho SOL vui nè SOL ơi 💜 #MOONLIGHT #LUNAS #SOL #dieplamanh #ninhduonglanngoc #trangphap #huyenbaby #khongtuquynh #tiktokgiaitri ,2024-05-27 17:56:33,27/05/2024,False,https://www.tiktok.com/@dieplamanh,MOONLIGHT,7369840445692282896,https://www.tiktok.com/@dieplamanh/video/7373631564720213249,146,6113,64,189000,339,80,"moonlight, lunas, sol, dieplamanh, ninhduonglanngoc, trangphap, huyenbaby, khongtuquynh, tiktokgiaitri",False,False,dieplamanh,False,False,False,1,9,8,0,0,1,0,0,0
"Focus Cam | Showcase 💜 Cún hơi quên bài 1 tí, tại cứ mải cười với SOL 🤭 #MOONLIGHT #LUNAS #SOL #dieplamanh #tiktokgiaitri #moonlightdance #fyp ",2024-05-27 14:25:13,27/05/2024,False,https://www.tiktok.com/@dieplamanh,MOONLIGHT,7369840445692282896,https://www.tiktok.com/@dieplamanh/video/7373577097706523905,120,4616,63,181800,222,72,"moonlight, lunas, sol, dieplamanh, tiktokgiaitri, moonlightdance, fyp",False,False,dieplamanh,False,False,False,2,7,16,0,0,1,0,0,0
Dư xăng 🤭 #MOONLIGHT #LUNAS #SOL #dieplamanh #tiktokgiaitri ,2024-05-26 13:44:37,26/05/2024,False,https://www.tiktok.com/@dieplamanh,MOONLIGHT,7369840445692282896,https://www.tiktok.com/@dieplamanh/video/7373195554379107585,25,3801,46,71200,197,80,"moonlight, lunas, sol, dieplamanh, tiktokgiaitri",False,False,dieplamanh,False,False,False,1,5,2,0,0,1,0,0,1
Xin chào bạn NYX - Cún đến từ LUNAS đây 🌙 #MOONLIGHT #LUNAS #SOL #visual #makeup #tiktokgiaitri #dieplamanh #fyp ,2024-05-24 19:29:54,24/05/2024,False,https://www.tiktok.com/@dieplamanh,Sabilulungan,7140153516764432386,https://www.tiktok.com/@dieplamanh/video/7372542374485953808,38,8135,153,142400,392,127,"moonlight, lunas, sol, visual, makeup, tiktokgiaitri, dieplamanh, fyp",False,False,dieplamanh,False,False,False,1,8,10,0,0,0,1,0,0
Focus Cam - Dance Break tưng bừng khói lửa lên nào chị em ơi ❤️‍🔥 #MOONLIGHT #LUNAS #SOL #dieplamanh #tiktokgiaitri #moonlightdance #dancechallenge ##viral #fyp ,2024-05-24 17:34:00,24/05/2024,False,https://www.tiktok.com/@dieplamanh,MOONLIGHT,7369840445692282896,https://www.tiktok.com/@dieplamanh/video/7372512503835659537,25,14700,79,332000,465,95,"moonlight, lunas, sol, dieplamanh, tiktokgiaitri, moonlightdance, dancechallenge, viral, fyp",False,False,dieplamanh,False,False,True,2,9,16,0,0,1,0,0,0
Hậu trường quay MV có thực sự bình thường không ạ? 😂 #MOONLIGHT #LUNAS #SOL #tiktokgiaitri #dieplamanh #ninhduonglanngoc #trangphap #huyenbaby #khongtuquynh #moonlightdance ,2024-05-24 08:59:02,24/05/2024,False,https://www.tiktok.com/@dieplamanh,MOONLIGHT,7369840445692282896,https://www.tiktok.com/@dieplamanh/video/7372379775593090320,116,23500,323,624600,1236,148,"moonlight, lunas, sol, tiktokgiaitri, dieplamanh, ninhduonglanngoc, trangphap, huyenbaby, khongtuquynh, moonlightdance",False,False,dieplamanh,False,False,True,1,10,11,0,1,0,0,0,0
Focus Cam - Moonlight của bạn Nyx Diệp Lâm Cún 🌙 #MOONLIGHT #LUNAS #SOL #moonlightdance #tiktokgiaitri #dieplamanh #dance #fyp #viral ,2024-05-23 15:09:47,23/05/2024,False,https://www.tiktok.com/@dieplamanh,MOONLIGHT,7369840445692282896,https://www.tiktok.com/@dieplamanh/video/7372104262614093073,27,29700,128,469400,706,183,"moonlight, lunas, sol, moonlightdance, tiktokgiaitri, dieplamanh, dance, fyp, viral",False,False,dieplamanh,False,False,True,1,9,10,0,0,1,0,0,0
🐶 và 🍇 Dance Break MOONLIGHT cho mọi người coi nè 🫶🏻🫶🏻🫶🏻 #MOONLIGHT #LUNAS #SOL #dancechallenge #moonlightdance #tiktokgiaitri #dieplamanh #ninhduonglanngoc #fyp #viral #dance @Ninh Dương Lan Ngọc ,2024-05-22 17:55:44,22/05/2024,False,https://www.tiktok.com/@dieplamanh,MOONLIGHT,7369840445692282896,https://www.tiktok.com/@dieplamanh/video/7371775937773391121,24,113800,468,2300000,2811,522,"moonlight, lunas, sol, dancechallenge, moonlightdance, tiktokgiaitri, dieplamanh, ninhduonglanngoc, fyp, viral, dance, ",False,False,dieplamanh,False,False,True,3,11,13,0,0,1,0,0,0
MOONLIGHT 🌙 Dance Break - Planet Lunas với Nyx nào cị emmmm❤️‍🔥 #MOONLIGHT #LUNAS #SOL #dancechallenge #moonlightdance #tiktokgiaitri #dieplamanh #fyp #cuncun #viral ,2024-05-22 12:41:12,22/05/2024,False,https://www.tiktok.com/@dieplamanh,MOONLIGHT,7369840445692282896,https://www.tiktok.com/@dieplamanh/video/7371694872211819793,24,16400,102,266800,496,208,"moonlight, lunas, sol, dancechallenge, moonlightdance, tiktokgiaitri, dieplamanh, fyp, cuncun, viral",False,False,dieplamanh,False,False,True,3,10,11,0,0,1,0,0,0
Giao diện ngầu..Nhưng hệ điều hành hơi lag 😂 #moonlight #lunas #sol #tiktokgiaitri #dieplamanh #sol #fyp ,2024-05-21 21:27:23,21/05/2024,False,https://www.tiktok.com/@dieplamanh,MOONLIGHT,7369840445692282896,https://www.tiktok.com/@dieplamanh/video/7371459398113234193,84,5215,61,182600,293,83,"moonlight, lunas, sol, tiktokgiaitri, dieplamanh, sol, fyp",False,False,dieplamanh,False,False,False,1,7,8,0,0,0,1,0,0
Bé U và bé N nhảy Moonlight Dance Challenge ❤️‍🔥 #moonlight #lunas #dieplamanh #ninhduonglanngoc #dancechallenge #moonlightdance #tiktokgiaitri #sol #fyp @Ninh Dương Lan Ngọc ,2024-05-21 18:04:48,21/05/2024,False,https://www.tiktok.com/@dieplamanh,MOONLIGHT,7369840445692282896,https://www.tiktok.com/@dieplamanh/video/7371407199655972097,22,26900,110,422700,636,172,"moonlight, lunas, dieplamanh, ninhduonglanngoc, dancechallenge, moonlightdance, tiktokgiaitri, sol, fyp, ",False,False,dieplamanh,False,False,True,2,9,14,0,0,0,1,0,0
Đạo diễn phân cho vai cũng nhàn 😂 #moonlight #lunas #sol #cuncun #dieplamanh #nyx #visual #tiktokgiaitri #fyp ,2024-05-21 13:48:10,21/05/2024,False,https://www.tiktok.com/@dieplamanh,MOONLIGHT,7369840445692282896,https://www.tiktok.com/@dieplamanh/video/7371341045604371728,42,6494,121,94600,299,94,"moonlight, lunas, sol, cuncun, dieplamanh, nyx, visual, tiktokgiaitri, fyp",False,False,dieplamanh,False,False,False,1,9,7,0,0,1,0,0,0
"‘Moonlight 🌙 Anh cứ nhìn vào mắt em là say. 
#lunas #moonlight #moonlightdance #dancechallenge #fyp #tiktokgiaitri #dieplamanh #viral ",2024-05-21 12:18:33,21/05/2024,True,https://www.tiktok.com/@dieplamanh,MOONLIGHT,7369840445692282896,https://www.tiktok.com/@dieplamanh/video/7371317943554100496,25,156600,1039,3200000,3281,901,"lunas, moonlight, moonlightdance, dancechallenge, fyp, tiktokgiaitri, dieplamanh, viral",False,False,dieplamanh,False,False,True,1,8,9,0,0,1,0,0,0
Ăn miếng rồi ra gác cửa tiếp nè 🤭 #LUNAS #MOONLIGHT #SOL #DiepLamAnh ,2024-05-21 00:44:46,20/05/2024,False,https://www.tiktok.com/@dieplamanh,MOONLIGHT,7369840445692282896,https://www.tiktok.com/@dieplamanh/video/7371139138344537345,123,7319,162,115100,429,87,"lunas, moonlight, sol, dieplamanh",False,False,dieplamanh,False,False,False,1,4,8,1,0,0,0,0,0
"LUNAS mang ‘MOONLIGHT’ tới rồi đây ❤️‍🔥 #LUNAS #MOONLIGHT #SOL
#TrangPhap #NinhDuongLanNgoc #DiepLamAnh #HuyenBaby #KhongTuQuynh #Dance #tiktokgiaitri #fyp #viral ",2024-05-20 20:19:34,20/05/2024,False,https://www.tiktok.com/@dieplamanh,MOONLIGHT,7369840445692282896,https://www.tiktok.com/@dieplamanh/video/7371070840131030289,45,12300,140,168100,373,192,"lunas, moonlight, sol, trangphap, ninhduonglanngoc, dieplamanh, huyenbaby, khongtuquynh, dance, tiktokgiaitri, fyp, viral",False,False,dieplamanh,False,False,True,2,12,7,0,0,0,1,0,0
Phước - Lộc - Thọ U40 dung dăng dung dẻ 🤭 #dieplamanh #chipu #ngocphuoc ,2024-05-18 20:46:17,18/05/2024,False,https://www.tiktok.com/@dieplamanh,Baby Doll - Utopia,6934127653935008514,https://www.tiktok.com/@dieplamanh/video/7370335544439573777,33,7675,33,164000,254,85,"dieplamanh, chipu, ngocphuoc",False,False,dieplamanh,False,False,False,1,3,10,0,0,0,1,0,1
,2024-05-18 20:33:16,18/05/2024,False,https://www.tiktok.com/@dieplamanh,im the drama,7296511893645642501,https://www.tiktok.com/@dieplamanh/video/7370332197682793745,0,5136,14,92300,185,45,,True,False,dieplamanh,False,False,False,0,0,0,0,0,0,1,0,1
