text,createTime,createTimeISO,isAd,profileUrl,musicName,musicId,webVideoUrl,duration,diggCount,shareCount,playCount,collectCount,commentCount,hashtags,isSlideshow,isSponsored,kol_username,ttSeller,commerceUser,is_trending,emoji_count,hashtag_count,word_count_no_emoji_hashtag,early_morning,morning,afternoon,evening,late_night,is_weekend
"TONER 7 BƯỚC!? 
Các nàng nhớ đọc cả note tui ghi trên clip nha, chi tiết vỗ luôn đó. Đơn giản đó mà #tiktok #cami #toner ",2024-12-12 08:18:15,12/12/2024,True,https://www.tiktok.com/@dieplinhcami,Vlog ・ Stylish city pop(1275391),7200478944389564418,https://www.tiktok.com/@dieplinhcami/video/7447328450181991701,75,671,11,904900,50,8,"tiktok, cami, toner",False,False,dieplinhcami,True,False,False,0,3,23,0,1,0,0,0,0
"Món ngon bồi bổ sức khỏe, khí huyết lưu thông, da dẻ hồng hào bằng NCKD nè mấy nàng #PhilipsDeNauDeThuong #AiNauCungNgon #PhilipsHomeLivingVN #tiktok #cami ",2024-12-11 18:00:37,11/12/2024,True,https://www.tiktok.com/@dieplinhcami,nhạc nền - Cami,7447107623624641296,https://www.tiktok.com/@dieplinhcami/video/7447107493496442133,88,271,8,153700,26,28,"PhilipsDeNauDeThuong, AiNauCungNgon, PhilipsHomeLivingVN, tiktok, cami",False,False,dieplinhcami,True,False,False,0,5,19,0,0,0,1,0,0
Set này cũng xinh mà không đi được moto 😆 ,2024-12-11 10:11:36,11/12/2024,False,https://www.tiktok.com/@dieplinhcami,Gorgeous,6752003160799201281,https://www.tiktok.com/@dieplinhcami/video/7446986607279787285,6,169,3,7931,8,3,,False,False,dieplinhcami,True,False,False,1,0,9,0,1,0,0,0,0
Chúc các bạn có một tình yêu thật bền lâu nha #cami #tikto #love ,2024-12-07 16:01:06,07/12/2024,False,https://www.tiktok.com/@dieplinhcami,Little fresh love like you rabbit much,7378230527638112293,https://www.tiktok.com/@dieplinhcami/video/7445592363679976722,40,175,1,7393,1,2,"cami, tikto, love",False,False,dieplinhcami,True,False,False,0,3,11,0,0,1,0,0,1
"Chăm sóc tóc mùa hanh khô với Linh nha
#Tsubaki #PhucHoiHuTon #DauHoaTraNhat #tiktok ",2024-12-02 18:12:38,02/12/2024,False,https://www.tiktok.com/@dieplinhcami,Vlog ・ Stylish city pop(1275391),7200478944389564418,https://www.tiktok.com/@dieplinhcami/video/7443770832146550034,65,74,3,142100,1,5,"tsubaki, phuchoihuton, dauhoatranhat, tiktok",False,False,dieplinhcami,True,False,True,0,4,9,0,0,0,1,0,0
Review nhanh 10 món đồ skincare. Các bạn đã dùng bao nhiêu trên 10 món này rồi 😉 #skincare #tiktok #cami ,2024-11-30 14:50:03,30/11/2024,False,https://www.tiktok.com/@dieplinhcami,nhạc nền - Cami,7442976571712998160,https://www.tiktok.com/@dieplinhcami/video/7442976455438388487,86,249,1,14000,51,19,"skincare, tiktok, cami",False,False,dieplinhcami,True,False,False,1,3,17,0,0,1,0,0,1
"Sau bao lần da tan nát thì vẫn cứ là trộm vía! Đồ ngon và biết cách chăm ạ 
100% cam thường tới đây! Tối nay dưỡng 1 lớp serum và test Oil mới hihi! Xin phép lan toả sự mê đắm Oil tới chị em ạ 🫰🏻 #skincare #oil #cami",2024-11-29 21:45:45,29/11/2024,False,https://www.tiktok.com/@dieplinhcami,omg,7247982484036586282,https://www.tiktok.com/@dieplinhcami/video/7442712499390106887,5,2131,15,113000,145,36,"skincare, oil, cami",False,False,dieplinhcami,True,False,False,1,3,47,0,0,0,1,0,0
Thời tiết Ninh Bình sáng nay kiểu…. 🫰 #ninhbinh #vietnam #cami #tiktok ,2024-11-28 11:09:35,28/11/2024,False,https://www.tiktok.com/@dieplinhcami,odoriko,7021757425230383105,https://www.tiktok.com/@dieplinhcami/video/7442177462391377159,11,144,3,7091,8,8,"ninhbinh, vietnam, cami, tiktok",False,False,dieplinhcami,True,False,False,1,4,7,0,1,0,0,0,0
3 sắc thái da sáng nay! Mùa này hanh khô da dễ mất nước và sần bề mặt nên phải tích cực chăm dưỡng bảo vệ nha các chị iêm 👊 #cami #skincareroutine #skincare #tiktok ,2024-11-25 09:31:46,25/11/2024,False,https://www.tiktok.com/@dieplinhcami,nhạc nền - Cami,7441039034547407617,https://www.tiktok.com/@dieplinhcami/video/7441039002586582279,13,158,1,9140,5,7,"cami, skincareroutine, skincare, tiktok",False,False,dieplinhcami,True,False,False,1,4,30,0,1,0,0,0,0
Món ngon cho da mùa nắng hanh miền Bắc #OLAYPartner #tiktok #skincare #cami ,2024-11-23 19:48:19,23/11/2024,True,https://www.tiktok.com/@dieplinhcami,nhạc nền - Cami,7440455766366014209,https://www.tiktok.com/@dieplinhcami/video/7440455727740734728,71,1153,33,1200000,103,13,"olaypartner, tiktok, skincare, cami",False,False,dieplinhcami,True,False,False,0,4,9,0,0,0,1,0,1
Riêng cushion và xịt dưỡng Cami đang sale sâu lắm các bác ơiii! Mỗi năm 1 lần giá tốt nhất năm đó ạ #cami #tiktok #skincare ,2024-11-23 16:04:44,23/11/2024,False,https://www.tiktok.com/@dieplinhcami,nhạc nền - Cami,7440398146288487169,https://www.tiktok.com/@dieplinhcami/video/7440398105201216786,49,129,1,8452,9,7,"cami, tiktok, skincare",False,False,dieplinhcami,True,False,False,0,3,23,0,0,1,0,0,1
"35 Ninh Bình xin chào các bạn nhé 🫶🏻 #cami #tiktok 
Anh chị em Ninh Bình có đoán được cảnh trong clip là ở đâu không ạ 😉",2024-11-22 16:29:38,22/11/2024,False,https://www.tiktok.com/@dieplinhcami,Vlog ・ Stylish city pop(1275391),7200478944389564418,https://www.tiktok.com/@dieplinhcami/video/7440033440415698183,36,222,8,8509,13,9,"cami, tiktok",False,False,dieplinhcami,True,False,False,2,2,24,0,0,1,0,0,0
Trả lời @ThanhMad Cmt thấy đã lâu mà giờ mới có dịp trả lời. Cảm ơn cmt của em để chị có cơ hội flex sương sương chồng c 🤭 #tiktok #cami ,2024-11-16 17:00:32,16/11/2024,False,https://www.tiktok.com/@dieplinhcami,Trái Đất Tròn,7430396449394936592,https://www.tiktok.com/@dieplinhcami/video/7437814892335271175,32,387,7,17500,6,5,", tiktok, cami",False,False,dieplinhcami,True,False,False,1,2,29,0,0,1,0,0,1
Đam mê cặp này thực sự đấy. Không nghĩ nó lại ăn nhập với nhau thế luôn. Dùng từ Gel Aqua cho sang kem Aqua Peptides vẫn cứ là ưng ạ! #cami #tiktok ,2024-11-14 16:07:33,14/11/2024,False,https://www.tiktok.com/@dieplinhcami,nhạc nền - Cami,7437059193305107216,https://www.tiktok.com/@dieplinhcami/video/7437059071007542535,41,216,0,11000,20,5,"cami, tiktok",False,False,dieplinhcami,True,False,False,0,2,31,0,0,1,0,0,0
Mặc set đồ trắng tung tăng ngày cuối tuần. Thích cái nắng vàng ươm này quá đi các bạn ơiii 🔅 #cami #tiktok ,2024-11-08 10:26:40,08/11/2024,False,https://www.tiktok.com/@dieplinhcami,♡ ᶫᵒᵛᵉᵧₒᵤ ♡,7080856813989677093,https://www.tiktok.com/@dieplinhcami/video/7434744681415658768,12,115,3,7167,6,10,"cami, tiktok",False,False,dieplinhcami,True,False,False,1,2,20,0,1,0,0,0,0
Chăm tóc mềm mượt bằng em dầu xả Pantene #Pantene#PhucHoiHuTon #tiktok #cami ,2024-11-07 20:12:27,07/11/2024,False,https://www.tiktok.com/@dieplinhcami,Vlog ・ Stylish city pop(1275391),7200478944389564418,https://www.tiktok.com/@dieplinhcami/video/7434524550852824336,49,98,5,6834,18,9,"pantene, phuchoihuton, tiktok, cami",False,False,dieplinhcami,True,False,False,0,4,9,0,0,0,1,0,0
"Nghịch nhà 😈
Bye góc tường trắng nhàm chán 👾 #home #cami ",2024-11-06 10:21:46,06/11/2024,False,https://www.tiktok.com/@dieplinhcami,APT.,7426810399384815632,https://www.tiktok.com/@dieplinhcami/video/7434001261646630162,29,241,0,15800,5,5,"home, cami",False,False,dieplinhcami,True,False,False,2,2,8,0,1,0,0,0,0
Chiếc quần cứ khô lại mặc của tui trong suốt hè vừa rồi 😘 #cami #tiktok ,2024-11-06 09:40:23,06/11/2024,False,https://www.tiktok.com/@dieplinhcami,APT.,7426810399384815632,https://www.tiktok.com/@dieplinhcami/video/7433990608512994568,39,146,0,9939,8,0,"cami, tiktok",False,False,dieplinhcami,True,False,False,1,2,13,0,1,0,0,0,0
"Trả lời @ahnguyettt213 Áo xinh lắm luôn. Các banh mua tại ig Camiforlady nha, qua ngắm thêm nhiều đồ xinh khác nữaaaaa 🥰",2024-11-05 12:14:13,05/11/2024,False,https://www.tiktok.com/@dieplinhcami,nhạc nền - Cami,7433659194869713680,https://www.tiktok.com/@dieplinhcami/video/7433659161273060626,35,202,9,37000,92,11,,False,False,dieplinhcami,True,False,False,1,0,22,0,0,1,0,0,0
"Gần Tết, gần các dịp lễ hội rồi tui biết chị em chúng ta sẽ mặc trễ vai nhiều lắm, nên phải share lại em áo này, chất lượng lắm luôn. Năm trước tui đã share rồi năm nay phải share lại. Mẫu này tui mặc vài năm nay giặt sấy suốt mà không mất form vẫn ôm nâng không dão luôn
Qua ig Camiforlady mua nha chị em ơiiii #cami #tikto ",2024-11-04 10:20:06,04/11/2024,False,https://www.tiktok.com/@dieplinhcami,nhạc nền - Cami,7433258701357632257,https://www.tiktok.com/@dieplinhcami/video/7433258670630227208,46,61300,1048,1200000,15500,151,"cami, tikto",False,False,dieplinhcami,True,False,True,0,2,70,0,1,0,0,0,0
"Trả lời @Góc nhỏ của bạn My shop Chả hiểu sao cắt tóc xong bị kêu giống Dương Gió Tai ạ 😭
Các bác vào nói 1 câu công bằng xem giống không chứ tôi nghe xong sốc ngang ",2024-11-03 10:12:38,03/11/2024,False,https://www.tiktok.com/@dieplinhcami,Fallin' All In You,6684805960273234692,https://www.tiktok.com/@dieplinhcami/video/7432885664301075730,5,574,19,37500,83,14,,False,False,dieplinhcami,True,False,False,1,0,38,0,1,0,0,0,1
"Kinh nghiệm chăm sóc bản thân đầy mình, nay xin phép chia sẻ vài điều mình làm sau khi nặn mụn nhé! Và tất nhiên bên ngoài vẫn phải bôi thoa chăm sóc đều đặn nha #cami #skincare ",2024-11-02 10:52:03,02/11/2024,False,https://www.tiktok.com/@dieplinhcami,Cooking Vlog,7378262338648377363,https://www.tiktok.com/@dieplinhcami/video/7432524737957350663,56,1429,19,44400,155,11,"cami, skincare",False,False,dieplinhcami,True,False,False,0,2,36,0,1,0,0,0,1
Nói năm nay mới 18 tuổi các bác có tin không ạ 🤭 #cami #tik ,2024-11-02 09:13:00,02/11/2024,False,https://www.tiktok.com/@dieplinhcami,nhạc nền - Cami,7432499234374454017,https://www.tiktok.com/@dieplinhcami/video/7432499188019039496,14,307,14,19800,100,15,"cami, tik",False,False,dieplinhcami,True,False,False,1,2,12,0,1,0,0,0,1
"Xin hãy bỏ qua chiếc đầu tóc rối bời mà tập trung vào hàng lông mi tự nhiên 100% được nuôi dưỡng bởi Oil ạ 🙈
Nay kẹp chuốt xong mà cứ tự mình tấm tắc khen, chỉ càn thế thôi không cần gì nhiều haha
Oil 100 điểm không có nhưng 👌",2024-10-31 09:44:38,31/10/2024,False,https://www.tiktok.com/@dieplinhcami,Soft,6645180804945152769,https://www.tiktok.com/@dieplinhcami/video/7431765182134684935,7,759,3,39400,47,7,,False,False,dieplinhcami,True,False,False,2,0,51,0,1,0,0,0,0
Thứ tôi không thể sống thiếu vào mùa hanh khô miền Bắc này 🫶🏻,2024-10-29 19:10:54,29/10/2024,False,https://www.tiktok.com/@dieplinhcami,Little Happiness,7190209106278369281,https://www.tiktok.com/@dieplinhcami/video/7431168906049441041,11,112,2,9529,2,6,,False,False,dieplinhcami,True,False,True,1,0,13,0,0,0,1,0,0
"Giá thành bình dân nhưng chất lượng cao cấp 🫶🏻
Quan trọng massage đúng kĩ thuật sạch sâu và đủ thời gian nha, các nàng cmt xem có muốn tui lên clip massage sạch sâu không ạ !? #cami #skincare #tiktokviral ",2024-10-29 16:53:59,29/10/2024,False,https://www.tiktok.com/@dieplinhcami,nhạc nền - Cami,7431133695827905281,https://www.tiktok.com/@dieplinhcami/video/7431133661266840840,48,148,2,10600,31,9,"cami, skincare, tiktokviral",False,False,dieplinhcami,True,False,False,1,3,37,0,0,1,0,0,0
Rèn luyện mãi tôi mới tham gia được bộ môn dậy sớm 🍃 #cami #tiktok ,2024-10-17 11:22:26,17/10/2024,False,https://www.tiktok.com/@dieplinhcami,A Happy,7378254758793971731,https://www.tiktok.com/@dieplinhcami/video/7426595198395878663,53,586,0,17800,23,9,"cami, tiktok",False,False,dieplinhcami,True,False,False,1,2,12,0,1,0,0,0,0
Chúc bạn hạnh phúc nếu xem được clip của mình 🌻 #cami #tiktok ,2024-10-15 11:48:08,15/10/2024,False,https://www.tiktok.com/@dieplinhcami,Little fresh love like you rabbit much,7378230527638112293,https://www.tiktok.com/@dieplinhcami/video/7425859645266349319,43,513,6,18100,25,16,"cami, tiktok",False,False,dieplinhcami,True,False,False,1,2,10,0,1,0,0,0,0
"Thích chiếc áo này, địa điểm mua IG Camiforlady ạ #Cami #tiktok ",2024-10-15 10:12:23,15/10/2024,False,https://www.tiktok.com/@dieplinhcami,nhạc nền - Cami,7425835015566822145,https://www.tiktok.com/@dieplinhcami/video/7425834976999951624,18,287,4,56300,47,4,"cami, tiktok",False,False,dieplinhcami,True,False,False,0,2,10,0,1,0,0,0,0
Chuyên mục review miếng dán mụn cho chị em nhé! #cami #tiktok #acnepatch #acnepatchplus #spotlighteningpatch #dermaangel,2024-10-14 17:52:38,14/10/2024,False,https://www.tiktok.com/@dieplinhcami,Little fresh love like you rabbit much,7378230527638112293,https://www.tiktok.com/@dieplinhcami/video/7425582491693731093,47,1112,9,42200,29,2,"cami, tiktok, acnepatch, acnepatchplus, spotlighteningpatch, dermaangel",False,False,dieplinhcami,True,False,False,0,6,10,0,0,1,0,0,0
"Đắp mask, tắm nắng sáng ☺️
Chill lắm các bác ơi!!! #cami #tiktok ",2024-10-11 07:45:17,11/10/2024,False,https://www.tiktok.com/@dieplinhcami,nhạc nền - Cami,7424312800514001665,https://www.tiktok.com/@dieplinhcami/video/7424312675447999764,50,720,4,38100,40,21,"cami, tiktok",False,False,dieplinhcami,True,False,False,1,2,11,0,1,0,0,0,0
Yêu bản thân chưa bao giờ dễ dàng đến thế 🥰 #cami #tiktok ,2024-10-10 11:40:01,10/10/2024,False,https://www.tiktok.com/@dieplinhcami,Little fresh love like you rabbit much,7378230527638112293,https://www.tiktok.com/@dieplinhcami/video/7424002128252783880,36,378,7,14100,39,7,"cami, tiktok",False,False,dieplinhcami,True,False,False,1,2,10,0,1,0,0,0,0
"Tối dưỡng Oil, sáng táp cushion! Da lúng liếng đón nắng! Cam thường luôn các bạn iu
 ☺️ #cami #skincare ",2024-10-06 10:17:45,06/10/2024,False,https://www.tiktok.com/@dieplinhcami,Happy Time（剪辑版）,6994398237008447524,https://www.tiktok.com/@dieplinhcami/video/7422496571100531988,6,387,3,19300,12,16,"cami, skincare",False,False,dieplinhcami,True,False,False,1,2,18,0,1,0,0,0,1
Hôm nay bạn có hạnh phúc không 🪴 ,2024-10-04 10:23:37,04/10/2024,False,https://www.tiktok.com/@dieplinhcami,You Make Me Happy,7143283741230336002,https://www.tiktok.com/@dieplinhcami/video/7421755933832776978,26,113,0,7346,3,0,,False,False,dieplinhcami,True,False,False,1,0,7,0,1,0,0,0,0
Loa loa các chị em tôi! Cushion ngon lành trong lòng tui nay đang được giảm hẳn 100K. Qua page Cami chốt đơn nhớ các bác 👍 #camiskincare #cami ,2024-10-04 10:03:41,04/10/2024,False,https://www.tiktok.com/@dieplinhcami,nhạc nền - Cami,7421750879302208272,https://www.tiktok.com/@dieplinhcami/video/7421750779372915988,16,1217,7,93800,121,63,"camiskincare, cami",False,False,dieplinhcami,True,False,False,1,2,26,0,1,0,0,0,0
Thời gian yêu thích trong ngày 🫶🏻 #cami #tiktok #skincareviral ,2024-09-30 12:10:49,30/09/2024,False,https://www.tiktok.com/@dieplinhcami,original sound - moodformilena,7359459642407242497,https://www.tiktok.com/@dieplinhcami/video/7420299210286845191,8,226,0,14100,22,3,"cami, tiktok, skincareviral",False,False,dieplinhcami,True,False,False,1,3,6,0,0,1,0,0,0
"Vẫn là chiếc cushion tui đã lên N clip khen nó, chị em muốn mua nhắn qua Cami nhà tui nha
Đẹp lắm 😍 #Camiskincare #tiktok #skincare ",2024-09-21 12:50:35,21/09/2024,False,https://www.tiktok.com/@dieplinhcami,nhạc nền - Cami,7416969724614970113,https://www.tiktok.com/@dieplinhcami/video/7416969698400537874,23,3330,27,201200,499,72,"camiskincare, tiktok, skincare",False,False,dieplinhcami,True,False,False,1,3,23,0,0,1,0,0,1
Những ngày sau bão giông #cami #tiktok #trip #jimny ,2024-09-20 18:35:32,20/09/2024,False,https://www.tiktok.com/@dieplinhcami,original sound - Potato.,7259665564243905285,https://www.tiktok.com/@dieplinhcami/video/7416687501802228999,14,152,2,8169,5,0,"cami, tiktok, trip, jimny",False,False,dieplinhcami,True,False,False,0,4,5,0,0,0,1,0,0
Bình an những ngày sau bão Yagi 🔅 #cami #tiktok ,2024-09-14 09:57:33,14/09/2024,False,https://www.tiktok.com/@dieplinhcami,Beautiful Days,7273993036474992677,https://www.tiktok.com/@dieplinhcami/video/7414327461426646290,40,90,0,7766,3,3,"cami, tiktok",False,False,dieplinhcami,True,False,False,1,2,7,0,1,0,0,0,1
"Yagi qua đi để lại “bông hoa tình người” rất đẹp, mong rằng tất cả chúng ta đều bình an #cami #tiktok #yagi ",2024-09-12 13:49:20,12/09/2024,False,https://www.tiktok.com/@dieplinhcami,清晰自由欢乐喜悦 - Acoustic Guitar Peaceful,7274007396221208639,https://www.tiktok.com/@dieplinhcami/video/7413645056164384007,32,209,0,10100,3,1,"cami, tiktok, yagi",False,False,dieplinhcami,True,False,False,0,3,20,0,0,1,0,0,0
"Cushion đỉnh chóp trong lòng tui 💕. 2 lõi nữa nên 10 điểm không có nhưng ạ.Vif Vì vài lý do cá nhân em xin phép không để logo sản phẩm ạ. Chị em quan tâm thực sự nhắn qua Cami nhà tui tư vấn, gửi thông tin sản phẩm và  sẵn hàng các bạn chôtd đơn nha chị iêm ơiiii #cami ",2024-09-11 09:57:52,11/09/2024,False,https://www.tiktok.com/@dieplinhcami,Vlog ・ Stylish city pop(1275391),7200478944389564418,https://www.tiktok.com/@dieplinhcami/video/7413214331531234568,21,2639,55,204300,432,82,cami,False,False,dieplinhcami,True,False,False,1,1,61,0,1,0,0,0,0
Biến chiếc váy ngủ thành áo mặc chỉ trong phút chốc #cami #tiktok ,2024-09-09 11:55:42,09/09/2024,False,https://www.tiktok.com/@dieplinhcami,Beyonce,6977608652727257090,https://www.tiktok.com/@dieplinhcami/video/7412502499954806033,12,685,8,26300,56,10,"cami, tiktok",False,False,dieplinhcami,True,False,False,0,2,11,0,1,0,0,0,0
Sáng nay chúng mình đi săn bình minh ☀️ #tiktok #cami #trip #jimny ,2024-09-05 16:27:12,05/09/2024,False,https://www.tiktok.com/@dieplinhcami,Alibi,7367106469261298464,https://www.tiktok.com/@dieplinhcami/video/7411088157464071441,12,486,3,18300,11,2,"tiktok, cami, trip, jimny",False,False,dieplinhcami,True,False,False,1,4,9,0,0,1,0,0,0
"Vài vết thâm không làm chúng ta xấu đi, hãy cứ nâng niu và yêu thương làn da mình nhé các bạn 
#cami #skincareroutine #tiktok ",2024-08-30 16:20:47,30/08/2024,False,https://www.tiktok.com/@dieplinhcami,nhạc nền - Cô Trangg,7344357696553945857,https://www.tiktok.com/@dieplinhcami/video/7408860009163148552,21,1860,25,135600,174,32,"cami, skincareroutine, tiktok",False,False,dieplinhcami,True,False,False,0,3,22,0,0,1,0,0,0
"Trả lời @Sơn SC Các bác có muốn đi chill online không
 Nếu có dịp mời các bạn về quê mình chơi nha. Ninh Bình nhiều chỗ chill lắm  #cami #tiktok #trip #jimny ",2024-08-29 14:32:06,29/08/2024,False,https://www.tiktok.com/@dieplinhcami,I'm Good (Blue),7171176498647271426,https://www.tiktok.com/@dieplinhcami/video/7408460903466716424,65,462,11,22400,26,13,", cami, tiktok, trip, jimny",False,False,dieplinhcami,True,False,False,0,4,29,0,0,1,0,0,0
"Chia sẻ một chút về cặp đôi mình rất ưng trong tháng vừa rồi! Hiện tại vẫn duy trì để giảm tình trạng mụn tái phát! Với một người cơ địa dễ lên mụn mà lại suốt ngày thích đi ngao du đổi chỗ ở, nguồn nước, lối sinh hoạt  liên tục thì thực sự rất hữu ích! Các nàng có thể mua tại page Cami nhé 
#cami #tiktok #skincare ",2024-08-28 10:22:20,28/08/2024,False,https://www.tiktok.com/@dieplinhcami,nhạc nền - Cami,7408025485671779089,https://www.tiktok.com/@dieplinhcami/video/7408025464326966535,77,152,2,12600,31,6,"cami, tiktok, skincare",False,False,dieplinhcami,True,False,False,0,3,67,0,1,0,0,0,0
Em biết hiện tại này mình đang sống…. #cami #tiktok ,2024-08-27 11:29:09,27/08/2024,False,https://www.tiktok.com/@dieplinhcami,nhạc nền - hongloan19930,7403031150022691585,https://www.tiktok.com/@dieplinhcami/video/7407671592039255303,16,511,5,20700,19,8,"cami, tiktok",False,False,dieplinhcami,True,False,False,0,2,8,0,1,0,0,0,0
Trả lời @Phụng Võ Đi chill núi đồi ngắm hoàng hôn buông ☀️ #cami #tiktok #jimny ,2024-08-22 21:25:38,22/08/2024,False,https://www.tiktok.com/@dieplinhcami,Get Ready,7314039987904202753,https://www.tiktok.com/@dieplinhcami/video/7405969886284909842,40,253,3,14700,9,11,", cami, tiktok, jimny",False,False,dieplinhcami,True,False,False,1,3,13,0,0,0,1,0,0
Con cái nhà ai đây !? #cami #tik ,2024-08-22 12:58:57,22/08/2024,False,https://www.tiktok.com/@dieplinhcami,Simple Life,7166720369242408962,https://www.tiktok.com/@dieplinhcami/video/7405839311192476936,23,422,0,18300,24,10,"cami, tik",False,False,dieplinhcami,True,False,False,0,2,6,0,0,1,0,0,0
Có những ngày mưa rơi trong rừng… Bật âm thanh và nghe nó #cami #tiktok #jimny #suzukijimny ,2024-08-15 11:08:43,15/08/2024,False,https://www.tiktok.com/@dieplinhcami,nhạc nền - Cami,7403213340443118352,https://www.tiktok.com/@dieplinhcami/video/7403213304425909522,5,6338,708,203100,470,59,"cami, tiktok, jimny, suzukijimny",False,False,dieplinhcami,True,False,False,0,4,13,0,1,0,0,0,0
Cách giúp chị em chúng mình tiết kiệm tiền khi dưỡng da 💕#cami #tiktok #skincare ,2024-08-10 15:27:57,10/08/2024,False,https://www.tiktok.com/@dieplinhcami,nhạc nền - Cami,7401424793428757264,https://www.tiktok.com/@dieplinhcami/video/7401424688179596562,47,2554,29,96200,186,28,"cami, tiktok, skincare",False,False,dieplinhcami,True,False,False,1,3,12,0,0,1,0,0,1
"Vào một ngày hết đồ chăm da và không có gì để mặc thì chợt nhớ ra bạn là chủ shop mĩ phẩm và quần áo, phụ kiện 😎",2024-08-09 10:57:18,09/08/2024,False,https://www.tiktok.com/@dieplinhcami,Get Ready,7314039987904202753,https://www.tiktok.com/@dieplinhcami/video/7400983856083504392,38,185,2,11700,10,4,,False,False,dieplinhcami,True,False,False,1,0,28,0,1,0,0,0,0
"Truyền một ít năng lượng chăm da tới các bạn
Đợt này vất vả cả tâm trí lẫn làn da nhưng cuối cùng vẫn nhận quả ngọt nên cố lên nha các bạn! Bật mí đợt này bận tui không đi nổi spa lấy nhân và còn tự xử ở nhà nên lâu hơn vì có đồ nên tui mới dám thế chứ các bạn hãy tìm spa lấy nhân kết hợp chăm sóc để hiệu quả mà an toàn nha 
#cami #tiktok ",2024-08-07 17:17:26,07/08/2024,False,https://www.tiktok.com/@dieplinhcami,Vlog ・ Stylish city pop(1275391),7200478944389564418,https://www.tiktok.com/@dieplinhcami/video/7400339647735287048,55,192,2,12300,7,7,"cami, tiktok",False,False,dieplinhcami,True,False,False,0,2,81,0,0,1,0,0,0
Trả lời @Mây Hẹn cả nhà 14h30 chiều nay livestream tại page Cami nhé! Link page gắn đầu trang tiktok nhé 😉,2024-08-01 12:36:10,01/08/2024,False,https://www.tiktok.com/@dieplinhcami,nhạc nền - Cami,7398040735282891525,https://www.tiktok.com/@dieplinhcami/video/7398040643999763717,40,241,2,20500,34,16,,False,False,dieplinhcami,True,False,True,1,0,21,0,0,1,0,0,0
"Mở spa tại gia 😉
#camiskincare #cami #tiktok #skincare #chella ",2024-07-27 20:24:20,27/07/2024,True,https://www.tiktok.com/@dieplinhcami,Vlog ・ Stylish city pop(1275391),7200478944389564418,https://www.tiktok.com/@dieplinhcami/video/7396305869786402056,77,1823,43,100600,171,42,"camiskincare, cami, tiktok, skincare, chella",False,False,dieplinhcami,True,False,False,1,5,4,0,0,0,1,0,1
Cũng kha khá mệt nhưng thành quả thì thơm ngon hấp dẫn 😉 #cami #yeubepnghiennha ,2024-07-27 17:09:26,27/07/2024,False,https://www.tiktok.com/@dieplinhcami,Vlog ・ Stylish city pop(1275391),7200478944389564418,https://www.tiktok.com/@dieplinhcami/video/7396255648696044807,38,1499,2,51300,30,9,"cami, yeubepnghiennha",False,False,dieplinhcami,True,False,False,1,2,12,0,0,1,0,0,1
Một vài mẹo nhỏ chăm sóc sức khoẻ những ngày mưa nồm ẩm #cami #tiktok #home ,2024-07-23 11:01:49,23/07/2024,False,https://www.tiktok.com/@dieplinhcami,Vlog ・ Stylish city pop(1275391),7200478944389564418,https://www.tiktok.com/@dieplinhcami/video/7394676567634382088,35,204,0,11000,9,7,"cami, tiktok, home",False,False,dieplinhcami,True,False,False,0,3,13,0,1,0,0,0,0
"Quan điểm nặn mụn, cụ thể là mụn ẩn của tui 🫶🏻 #camiskincare #cami ",2024-07-15 11:54:31,15/07/2024,False,https://www.tiktok.com/@dieplinhcami,nhạc nền - Cami,7391721550384204560,https://www.tiktok.com/@dieplinhcami/video/7391721467072810258,112,2161,56,89000,312,68,"camiskincare, cami",False,False,dieplinhcami,True,False,False,1,2,11,0,1,0,0,0,0
Ai thích đồ trắng dơ tay 😉 ,2024-07-14 13:09:47,14/07/2024,False,https://www.tiktok.com/@dieplinhcami,Nasty,7353374941268363265,https://www.tiktok.com/@dieplinhcami/video/7391369780021792008,12,209,2,15100,32,5,,False,False,dieplinhcami,True,False,False,1,0,6,0,0,1,0,0,1
Đồ skincare các bạn qua Cami sẵn nhé! #cami #skincare ,2024-07-14 11:25:13,14/07/2024,False,https://www.tiktok.com/@dieplinhcami,Vlog ・ Stylish city pop(1275391),7200478944389564418,https://www.tiktok.com/@dieplinhcami/video/7391342832428059912,52,223,8,14500,35,4,"cami, skincare",False,False,dieplinhcami,True,False,False,0,2,8,0,1,0,0,0,1
Trả lời @Hồng Ngọc  Địa chỉ mua cây tui mới mò ra 🫶🏻,2024-07-13 15:24:19,13/07/2024,False,https://www.tiktok.com/@dieplinhcami,Vlog ・ Stylish city pop(1275391),7200478944389564418,https://www.tiktok.com/@dieplinhcami/video/7391033359171915016,30,64,0,8086,21,2,,False,False,dieplinhcami,True,False,False,1,0,12,0,0,1,0,0,1
