text,createTime,createTimeISO,isAd,profileUrl,musicName,musicId,webVideoUrl,duration,diggCount,shareCount,playCount,collectCount,commentCount,hashtags,isSlideshow,isSponsored,kol_username,ttSeller,commerceUser,is_trending,emoji_count,hashtag_count,word_count_no_emoji_hashtag,early_morning,morning,afternoon,evening,late_night,is_weekend
"Xu hướng phim ngắn đã bắt đầu, chúng ta bước những bước chân đầu tiên. Vừa đi vừa học hỏi, tạo nên những thước phim chất lượng điện ảnh nhưng dành để lướt trên màn hình điện thoại. Mỗi ngày bận rộn nhưng vẫn có thể giải trí bằng 1 tập phim chỉ kéo dài nhất là 90s. Đây cũng sẽ là thử thách cho nhà sản xuất. Cái gì mới thường sẽ rất nhiều dấu hỏi chấm. Cả nhà cùng làm quen với thể loại mới cùng #Dshorts nhé! #dieplamanh #bhd #tiktokgiaitri ",2024-11-27 22:45:24,27/11/2024,False,https://www.tiktok.com/@dieplamanh,Mashup Anh Đau Từ Lúc Em Đi x LTKT x VSTD,7434892462033750800,https://www.tiktok.com/@dieplamanh/video/7441985690079874312,29,160300,1002,2700000,3839,1161,"dshorts, dieplamanh, bhd, tiktokgiaitri",False,False,dieplamanh,False,False,False,0,4,89,0,0,0,0,1,0
Mặc váy xong cứ tưởng mình là công chúa thiệt 🥰🥰🥰 #dieplamanh #tiktokgiaitri ,2024-11-24 13:19:58,24/11/2024,False,https://www.tiktok.com/@dieplamanh,nhạc nền - Diệp Lâm Anh,7440726817692715792,https://www.tiktok.com/@dieplamanh/video/7440726726985993479,27,4183,67,117700,195,81,"dieplamanh, tiktokgiaitri",False,False,dieplamanh,False,False,False,1,2,10,0,0,1,0,0,1
Chị em LUNAS chúc mừng sinh nhật Bé Dâu 🎂🥳 #dieplamanh #tiktokgiaitri #lunas #ninhduonglanngoc #huyenbaby #khongtuquynh #trangphap,2024-11-21 11:11:23,21/11/2024,False,https://www.tiktok.com/@dieplamanh,nhạc nền - Diệp Lâm Anh,7439580377481513745,https://www.tiktok.com/@dieplamanh/video/7439580334150176008,118,3793,46,101100,224,56,"dieplamanh, tiktokgiaitri, lunas, ninhduonglanngoc, huyenbaby, khongtuquynh, trangphap",False,False,dieplamanh,False,False,False,1,7,9,0,1,0,0,0,0
Bốc thăm trúng được bạn Huyền Em Bé - Phú bà nhà vía ngay cho bạn Cún 1 chiếc ví hồng xinhhhh 💗@Huyền Baby #dieplamanh #huyenbaby #lunas ,2024-11-21 01:16:06,20/11/2024,False,https://www.tiktok.com/@dieplamanh,nhạc nền - Diệp Lâm Anh,7439427515078232849,https://www.tiktok.com/@dieplamanh/video/7439426936977362183,219,176000,1475,3300000,2773,349,", dieplamanh, huyenbaby, lunas",False,False,dieplamanh,False,False,False,1,3,24,1,0,0,0,0,0
Mukbanh cá cay rồi đi quẩy cùng các em đẹp 🤭 ,2024-11-15 23:14:45,15/11/2024,False,https://www.tiktok.com/@dieplamanh,nhạc nền - Diệp Lâm Anh,7437578636150672145,https://www.tiktok.com/@dieplamanh/video/7437540237758270728,74,110700,681,2900000,2241,365,,False,False,dieplamanh,False,False,False,1,0,10,0,0,0,0,1,0
Buổi họp báo đầy tiếng cười cùng dàn cast Hành Trình Kỳ Thú 2 🥰🥰🥰 #dieplamanh #tiktokgiaitri #lunas #hanhtrinhkythu2 #hanhtrinhkythu2024 ,2024-11-15 17:00:06,15/11/2024,False,https://www.tiktok.com/@dieplamanh,nhạc nền - Diệp Lâm Anh,7437444144622095105,https://www.tiktok.com/@dieplamanh/video/7437443693486820615,17,9131,56,263200,299,104,"dieplamanh, tiktokgiaitri, lunas, hanhtrinhkythu2, hanhtrinhkythu2024",False,False,dieplamanh,False,False,True,1,5,14,0,0,1,0,0,0
Phòng tập mà tưởng sảnh chờ phi phai 🤣 #dieplamanh #tiktokgiaitri #lunas #chidepdapgio2024 #trangphap #donganhquynh #minhhang #huyenbaby #ninhduonglanngoc #misthy #ngocthanhtam #khongtuquynh ,2024-11-13 19:54:17,13/11/2024,False,https://www.tiktok.com/@dieplamanh,nhạc nền - Diệp Lâm Anh,7436746436215163665,https://www.tiktok.com/@dieplamanh/video/7436746411481337095,12,12500,88,328800,626,119,"dieplamanh, tiktokgiaitri, lunas, chidepdapgio2024, trangphap, donganhquynh, minhhang, huyenbaby, ninhduonglanngoc, misthy, ngocthanhtam, khongtuquynh",False,False,dieplamanh,False,False,True,1,12,8,0,0,0,1,0,0
Tặng em Gấu yêu 10.000 vote ⭐️ Chút động viên nhỏ xíu xinh xinh từ fan U40 tại quê nhà 🇻🇳 @Nguyen Cao Ky Duyen cố lênnnn! #dieplamanh #nguyencaokyduyen #missuniverse,2024-11-12 23:58:11,12/11/2024,False,https://www.tiktok.com/@dieplamanh,nhạc nền - ⭐️ DJ Tâm Thanh Võ,7271590744757308166,https://www.tiktok.com/@dieplamanh/video/7436438169735810312,37,54300,937,879500,647,709,", dieplamanh, nguyencaokyduyen, missuniverse",False,False,dieplamanh,False,False,False,2,3,26,0,0,0,0,1,0
Cái tour ta nói nó rối đội hình dễ sợ luôn 😆 #lunas #trangphap #dieplamanh #huyenbaby #ninhduonglanngoc #khongtuquynh ,2024-11-08 18:28:49,08/11/2024,False,https://www.tiktok.com/@dieplamanh,nhạc nền - Diệp Lâm Anh,7434869154634681105,https://www.tiktok.com/@dieplamanh/video/7434868962850032914,140,12100,157,319200,431,68,"lunas, trangphap, dieplamanh, huyenbaby, ninhduonglanngoc, khongtuquynh",False,False,dieplamanh,False,False,True,1,6,11,0,0,0,1,0,0
Tóc đen và môi bóng 🫦 #makeup #layout #dieplamanh ,2024-11-05 12:02:13,05/11/2024,False,https://www.tiktok.com/@dieplamanh,nhạc nền - the.lady_y2k,7255111521085049605,https://www.tiktok.com/@dieplamanh/video/7433656067113946376,10,112800,698,1300000,3095,700,"makeup, layout, dieplamanh",False,False,dieplamanh,False,False,False,1,3,5,0,0,1,0,0,0
Một buổi tối thật tuyệt vời cùng các quý ông 🥰 #dieplamanh #tiktokgiaitri #thenextgentleman ,2024-11-03 19:47:57,03/11/2024,False,https://www.tiktok.com/@dieplamanh,nhạc nền - Diệp Lâm Anh,7433033949468805905,https://www.tiktok.com/@dieplamanh/video/7433033918632316168,20,255900,1589,3200000,4790,1303,"dieplamanh, tiktokgiaitri, thenextgentleman",False,False,dieplamanh,False,False,False,1,3,10,0,0,0,1,0,1
Visual này có ok khum cả nhà mình ❤️‍🔥 Chung kết SWF nên Cún đỏ nguyên cành luôn! #dieplamanh #dance #thegianmuonmau #swf #streetwomanfighter ,2024-11-02 23:07:17,02/11/2024,False,https://www.tiktok.com/@dieplamanh,nhạc nền - Diệp Lâm Anh,7432714231956392721,https://www.tiktok.com/@dieplamanh/video/7432714208782929159,40,5401,57,155600,299,94,"dieplamanh, dance, thegianmuonmau, swf, streetwomanfighter",False,False,dieplamanh,False,False,True,2,5,18,0,0,0,0,1,1
FOCUS CAM - THẾ GIAN MUÔN MÀU 🔥🔥🔥 #dieplamanh #tiktokgiaitri #streetwomanfightervietnam #thegianmuonmau ,2024-11-02 22:37:31,02/11/2024,False,https://www.tiktok.com/@dieplamanh,MOONLIGHT,7369840445692282896,https://www.tiktok.com/@dieplamanh/video/7432706528634785032,126,18000,193,345100,751,231,"dieplamanh, tiktokgiaitri, streetwomanfightervietnam, thegianmuonmau",False,False,dieplamanh,False,False,True,1,4,7,0,0,0,0,1,1
Cún thật xúc động trước tình cảm mà khán giả Việt Nam dành cho Duyên vào ngày hôm qua. Chúc Duyên luôn luôn tự tin và giữ gìn sức khoẻ để chiến đấu tại đấu trường sắc đẹp Quốc Tế #dieplamanh #tiktokgiaitri #nguyencaokyduyen #kyduyen #missuniverse @Nguyen Cao Ky Duyen ,2024-10-29 14:07:20,29/10/2024,False,https://www.tiktok.com/@dieplamanh,nhạc nền - Diệp Lâm Anh,7431091621628758801,https://www.tiktok.com/@dieplamanh/video/7431090715666468114,139,47300,210,767600,879,237,"dieplamanh, tiktokgiaitri, nguyencaokyduyen, kyduyen, missuniverse, ",False,False,dieplamanh,False,False,True,0,5,44,0,0,1,0,0,0
Chúc mừng người em Tăng Duy Tân với Album Khu Vườn Tình đầy nhiệt huyết 🥰 #dieplamanh #tiktokgiaitri #tangduytan #khuvuontinh ,2024-10-28 21:37:27,28/10/2024,False,https://www.tiktok.com/@dieplamanh,Ikigai,7429969837047613456,https://www.tiktok.com/@dieplamanh/video/7430835631443545351,22,8247,92,263900,330,107,"dieplamanh, tiktokgiaitri, tangduytan, khuvuontinh",False,False,dieplamanh,False,False,True,1,4,15,0,0,0,1,0,0
Khởi động cho nóng người 💗,2024-10-27 13:32:23,27/10/2024,False,https://www.tiktok.com/@dieplamanh,HOP ON DA SHOW,7415227543508764673,https://www.tiktok.com/@dieplamanh/video/7430339546899811592,33,33200,193,636400,748,123,,False,False,dieplamanh,False,False,False,1,0,5,0,0,1,0,0,1
“Hoa Xương Rồng” tại Bến Thượng Hải 🤭 #dieplamanh #hoaxuongrong #dance #shanghai ,2024-10-26 20:34:48,26/10/2024,False,https://www.tiktok.com/@dieplamanh,Hoa Xương Rồng,7428166917323016209,https://www.tiktok.com/@dieplamanh/video/7430077312835587336,16,82100,362,2000000,1975,293,"dieplamanh, hoaxuongrong, dance, shanghai",False,False,dieplamanh,False,False,False,1,4,7,0,0,0,1,0,1
Công nhận cơm cua lông Thượng Hải ngon thiệt 😝💗,2024-10-26 18:22:13,26/10/2024,False,https://www.tiktok.com/@dieplamanh,nhạc nền - Diệp Lâm Anh,7430043299039218448,https://www.tiktok.com/@dieplamanh/video/7430043149730401544,118,9226,129,352900,364,95,,False,False,dieplamanh,False,False,False,1,0,9,0,0,0,1,0,1
Focus Cam phải Vượt Ngàn Chông Gai là có thiệt 🫣 Stand by sớm cũng không tìm được vị trí đứng giữa 25.000 khán giả nên kỳ này bên cánh trái hoy cả nhà ơi…Một đêm concert thật sự cháy ❤️‍🔥 Cảm ơn tất cả mọi người!!! #ATVNCG #anhtraivuotnganchonggai #concert #LUNAS #hoaxuongrong #moonlight #dieplamanh #tiktokgiaitri #dance #live ,2024-10-20 11:59:45,20/10/2024,False,https://www.tiktok.com/@dieplamanh,nhạc nền - Diệp Lâm Anh,7427719045018831633,https://www.tiktok.com/@dieplamanh/video/7427718070543699207,154,61500,736,1300000,1814,448,"atvncg, anhtraivuotnganchonggai, concert, lunas, hoaxuongrong, moonlight, dieplamanh, tiktokgiaitri, dance, live",False,False,dieplamanh,False,False,True,3,10,46,0,1,0,0,0,1
Cún make up xong òyyyy #dieplamanh #acvncg #anhtraivuotnganchonggai #concert  #hoaxuongrong #lunas ,2024-10-19 21:26:34,19/10/2024,False,https://www.tiktok.com/@dieplamanh,nhạc nền - Diệp Lâm Anh,7424875844172057360,https://www.tiktok.com/@dieplamanh/video/7427493064253377799,13,8546,60,221700,332,95,"dieplamanh, acvncg, anhtraivuotnganchonggai, concert, hoaxuongrong, lunas",False,False,dieplamanh,False,False,False,0,6,5,0,0,0,1,0,1
Cún và LUNAS có hẹn với 20.000 khán giả tại sân khấu concert Anh Trai Vượt Ngàn Chông Gai ❤️‍🔥 #lunas #dieplamanh #anhtraivuotnganchonggai #concert #rehearsal #hoaxuongrong #moonlight #dance ,2024-10-19 12:33:47,19/10/2024,False,https://www.tiktok.com/@dieplamanh,nhạc nền - Diệp Lâm Anh,7427356496981609232,https://www.tiktok.com/@dieplamanh/video/7427355759618395400,116,20900,121,533100,614,147,"lunas, dieplamanh, anhtraivuotnganchonggai, concert, rehearsal, hoaxuongrong, moonlight, dance",False,False,dieplamanh,False,False,True,2,8,20,0,0,1,0,0,1
Rehearsal có bốc khum? :))) #hoaxuongrong #lunas #dieplamanh #rehearsal #anhtraivuotnganchonggai #dance ,2024-10-16 23:54:27,16/10/2024,False,https://www.tiktok.com/@dieplamanh,nhạc nền - Diệp Lâm Anh,7426417951932304129,https://www.tiktok.com/@dieplamanh/video/7426417910710668562,101,19600,228,469600,722,140,"hoaxuongrong, lunas, dieplamanh, rehearsal, anhtraivuotnganchonggai, dance",False,False,dieplamanh,False,False,False,0,6,5,0,0,0,0,1,0
Xu ghê 🤭 @Trang Phap #guichongtuonglai #trangphap ,2024-10-16 18:13:58,16/10/2024,False,https://www.tiktok.com/@dieplamanh,GỬI CHỒNG TƯƠNG LAI,7422937038330791953,https://www.tiktok.com/@dieplamanh/video/7426330173139619079,19,14800,176,254500,519,154,", guichongtuonglai, trangphap",False,False,dieplamanh,False,False,False,1,2,4,0,0,0,1,0,0
Shanghai Fashion Week | SIXDO | LUNAS 🦋 #dieplamanh #trangphap #ninhduonglanngoc #huyenbaby #khongtuquynh #lunas #hoaxuonhrong #sixdo #shanghai #fashionweek #tiktokgiaitri ,2024-10-15 20:17:12,15/10/2024,False,https://www.tiktok.com/@dieplamanh,nhạc nền - Diệp Lâm Anh,7425990933876853521,https://www.tiktok.com/@dieplamanh/video/7425990845410708754,40,14400,382,237200,744,171,"dieplamanh, trangphap, ninhduonglanngoc, huyenbaby, khongtuquynh, lunas, hoaxuonhrong, sixdo, shanghai, fashionweek, tiktokgiaitri",False,False,dieplamanh,False,False,True,1,11,7,0,0,0,1,0,0
HOA XƯƠNG RỒNG - Focus Cam 🦋 Cún thích đoạn rap Chang viết ghê 💜 #dieplamanh #lunas #hoaxuonhrong #tiktokgiaitri #anhtraivuotnganchonhgai,2024-10-15 12:32:51,15/10/2024,False,https://www.tiktok.com/@dieplamanh,nhạc nền - Diệp Lâm Anh,7425871669069433617,https://www.tiktok.com/@dieplamanh/video/7425871178767682823,173,34100,99,180200,375,57,"dieplamanh, lunas, hoaxuonhrong, tiktokgiaitri, anhtraivuotnganchonhgai",False,False,dieplamanh,False,False,False,2,5,13,0,0,1,0,0,0
Yêu được em là xác suất thống kê một trên triệu phần trăm - Hoa Xương Rồng #dieplamanh #lunas #nyx #hoaxuongrong #anhtraivuotnganchonggai #yeah1 ,2024-10-12 20:09:59,12/10/2024,False,https://www.tiktok.com/@dieplamanh,nhạc nền - Diệp Lâm Anh,7424875844172057360,https://www.tiktok.com/@dieplamanh/video/7424875734335769864,45,49500,451,889500,1746,498,"dieplamanh, lunas, nyx, hoaxuongrong, anhtraivuotnganchonggai, yeah1",False,False,dieplamanh,False,False,False,0,6,17,0,0,0,1,0,1
Trend này tui bao sân nhé 🤭#dieplamanh #trangphap #guichongtuonglai ,2024-10-10 10:37:18,10/10/2024,False,https://www.tiktok.com/@dieplamanh,GỬI CHỒNG TƯƠNG LAI,7422937038330791953,https://www.tiktok.com/@dieplamanh/video/7423985972703989000,36,93200,1316,1300000,3067,685,"dieplamanh, trangphap, guichongtuonglai",False,False,dieplamanh,False,False,True,1,3,6,0,1,0,0,0,0
Diệp quần đùi hoa tới đâyyy #dieplamanh #dance #lunas ,2024-10-08 19:33:29,08/10/2024,False,https://www.tiktok.com/@dieplamanh,nhạc nền - BÔNG HẬU KWANGYA😑🍂,7386146503934462737,https://www.tiktok.com/@dieplamanh/video/7423381985315261714,22,84800,395,1100000,2338,403,"dieplamanh, dance, lunas",False,False,dieplamanh,False,False,False,0,3,6,0,0,0,1,0,0
Nhớ mấy em đẹp gái này ghê 😇 #CapCut #dieplamanh #nyx#nyxegianmuonmau #lunas #fm #sol #cuncunteam #xinhbagai ,2024-10-08 11:48:47,08/10/2024,False,https://www.tiktok.com/@dieplamanh,Thế Gian Muôn Màu,7419379201088423952,https://www.tiktok.com/@dieplamanh/video/7423262213151935751,21,8370,64,156500,378,104,"capcut, dieplamanh, nyx, nyx, lunas, fm, sol, cuncunteam, xinhbagai",False,False,dieplamanh,False,False,False,1,9,7,0,1,0,0,0,0
Đu vui hăm bà?! 😂 #dieplamanh #trangphap #lunas @Trang Phap ,2024-10-06 22:42:25,06/10/2024,True,https://www.tiktok.com/@dieplamanh,nhạc nền - Diệp Lâm Anh,7422688528246622993,https://www.tiktok.com/@dieplamanh/video/7422688502321597714,19,172900,1141,5800000,4433,458,"dieplamanh, trangphap, lunas, ",False,False,dieplamanh,False,False,True,1,3,6,0,0,0,0,1,1
Vội gì khi đã dính nhau dính nhau 🌈 - #thegianmuonmau #dieplamanh ,2024-10-06 13:29:14,06/10/2024,False,https://www.tiktok.com/@dieplamanh,nhạc nền - NhoGauCun🍇🐻🐾,7420740208150203137,https://www.tiktok.com/@dieplamanh/video/7422545946568920328,28,12700,113,216500,480,143,"thegianmuonmau, dieplamanh",False,False,dieplamanh,False,False,False,1,2,9,0,0,1,0,0,1
Con bà Chang :))) #dieplamanh #trangphap @Trang Phap ,2024-10-05 20:35:28,05/10/2024,False,https://www.tiktok.com/@dieplamanh,Thế Gian Muôn Màu,7419379201088423952,https://www.tiktok.com/@dieplamanh/video/7422284704071552274,91,16900,174,322200,603,146,"dieplamanh, trangphap, ",False,False,dieplamanh,False,False,False,0,2,6,0,0,0,1,0,1
“Ta là nô lệ và âm nhạc là chủ nô” 🌈 #thegianmuonmau #audio#museplamanh #CapCut #tiktokgiaitri ,2024-10-02 16:26:31,02/10/2024,True,https://www.tiktok.com/@dieplamanh,Thế Gian Muôn Màu,7419379201088423952,https://www.tiktok.com/@dieplamanh/video/7421107286308883730,28,6034,46,125000,246,55,"thegianmuonmau, audio, mus, capcut, tiktokgiaitri",False,False,dieplamanh,False,False,True,1,5,10,0,0,1,0,0,0
"Trao cho nhau cái nắm tay, nắm tay
Thêm một lần ta đắm say, đắm say
Hơn thêm nữa thì tính sau, tính sau
Vội gì khi đã dính nhau, dính nhau
- THẾ GIAN MUÔN MÀU - 
#dieplamanh #thegianmuonmau ",2024-10-01 20:50:15,01/10/2024,True,https://www.tiktok.com/@dieplamanh,Thế Gian Muôn Màu,7419379201088423952,https://www.tiktok.com/@dieplamanh/video/7420804173127535879,38,5480,69,98400,321,105,"dieplamanh, thegianmuonmau",False,False,dieplamanh,False,False,True,0,2,38,0,0,0,1,0,0
Thế Gian Muôn Màu 🔮 #dieplamanh #thegianmuonmau ,2024-10-01 20:10:27,01/10/2024,False,https://www.tiktok.com/@dieplamanh,nhạc nền - Diệp Lâm Anh,7420793989307058945,https://www.tiktok.com/@dieplamanh/video/7420793912375151890,34,11100,109,153100,452,167,"dieplamanh, thegianmuonmau",False,False,dieplamanh,False,False,False,1,2,4,0,0,0,1,0,0
"Vì cuộc đời này là một món quà. Nhân gian này là ngôi nhà.
Vậy nên ta hãy…”disfruta esta vida” 💋 #dieplamanh #shooting #cover #audio #thegianmuonmau #tiktokgiaitri #hautruong ",2024-09-26 08:50:01,26/09/2024,True,https://www.tiktok.com/@dieplamanh,nhạc nền - Diệp Lâm Anh,7418763251514755857,https://www.tiktok.com/@dieplamanh/video/7418763119155039506,31,4285,212,91900,301,122,"dieplamanh, shooting, cover, audio, thegianmuonmau, tiktokgiaitri, hautruong",False,False,dieplamanh,False,False,False,1,7,20,0,1,0,0,0,0
Cún đã đóng gói xong sách vở và đồ dùng học tập để gửi tặng các em nhỏ ở Lục Yên - Yên Bái. Cảm ơn tất cả mọi người đã yêu thương và gửi quà để chung tay giúp các em nhỏ ở vùng bị ảnh hưởng bão lũ có thêm niềm vui tới trường 🫶🏻❤️ #dieplamanh #cuncun #cuncunteam @Phạm Kiên ,2024-09-23 12:19:24,23/09/2024,True,https://www.tiktok.com/@dieplamanh,nhạc nền - Diệp Lâm Anh,7417703951443446529,https://www.tiktok.com/@dieplamanh/video/7417703839404510471,67,12100,63,421800,479,169,"dieplamanh, cuncun, cuncunteam, ",False,False,dieplamanh,False,False,True,1,3,59,0,0,1,0,0,0
"Kể từ lúc em quyết định tham gia MUV anh cũng khá lo lắng. Sau này em mới nói em đã ấp ủ điều này từ rất lâu rồi. Em muốn bước ra đấu đấu trường quốc tế để hô vang 2 tiếng VIỆT NAM. Và giây phút em chạm tay được vào ước mơ của mình anh rất tự hào về em. Duyên của anh là một cô gái mạnh mẽ, bản lĩnh và biết được mình muốn gì. Yêu em! @Nguyen Cao Ky Duyen 💜 #nguyencaokyduyen #dieplamanh #muv #missuniverse #missuniversevietnam ",2024-09-16 22:40:04,16/09/2024,False,https://www.tiktok.com/@dieplamanh,nhạc nền - Diệp Lâm Anh,7415266222524140305,https://www.tiktok.com/@dieplamanh/video/7415266183978487047,59,29200,245,1100000,484,220,", nguyencaokyduyen, dieplamanh, muv, missuniverse, missuniversevietnam",False,False,dieplamanh,False,False,True,1,5,86,0,0,0,0,1,0
Lỡ đẹp trai quá rồi biết làm sao 😆 #dieplamanh ,2024-09-16 15:02:44,16/09/2024,False,https://www.tiktok.com/@dieplamanh,nhạc nền - Diệp Lâm Anh,7415148356357327617,https://www.tiktok.com/@dieplamanh/video/7415148331665591559,20,132200,480,2900000,3053,1025,dieplamanh,False,False,dieplamanh,False,False,False,1,1,8,0,0,1,0,0,0
Khoảnh khắc ấy… 🥹 Em đã làm được rồi Gấu ơi! ❤️ #kyduyen #muv #missuniverse @Nguyen Cao Ky Duyen ,2024-09-15 01:10:54,14/09/2024,False,https://www.tiktok.com/@dieplamanh,nhạc nền - Diệp Lâm Anh,7414562923344972561,https://www.tiktok.com/@dieplamanh/video/7414562883478015250,92,60500,156,1000000,876,310,"kyduyen, muv, missuniverse, ",False,False,dieplamanh,False,False,True,2,3,15,1,0,0,0,0,1
"Sống một cuộc đời có ý nghĩa chính là luôn suy nghĩ, hành động, phản ứng tích cực trước mọi điều trong cuộc sống. Ngày hôm nay, tôi không giầu nhưng tôi dám cho đi những gì mình có. Tôi không sức dài vai rộng nhưng tôi có thể đóng góp sự nhiệt huyết. Hướng về miền Bắc bằng cả trái tim 💗 #dieplamanh ",2024-09-12 22:14:31,12/09/2024,False,https://www.tiktok.com/@dieplamanh,nhạc nền - Diệp Lâm Anh,7413775322815974145,https://www.tiktok.com/@dieplamanh/video/7413775255564569874,111,13400,60,441600,382,199,dieplamanh,False,False,dieplamanh,False,False,False,1,1,62,0,0,0,0,1,0
Hơn 1000 phần quà tới tận tay bà con ở Yên Bái 💪🏻 ,2024-09-12 14:38:48,12/09/2024,False,https://www.tiktok.com/@dieplamanh,nhạc nền - Dr YeYe,7397019477784726288,https://www.tiktok.com/@dieplamanh/video/7413657814981250322,34,14200,40,380500,399,202,,False,False,dieplamanh,False,False,False,1,0,12,0,0,1,0,0,0
Hướng về Yên Bái với cả trái tim…300 phần nhu yếu phẩm cần thiết sẽ lên đường về quê của chị tôi @VICKY LAMCUC (Daily) 💗,2024-09-10 21:50:41,10/09/2024,False,https://www.tiktok.com/@dieplamanh,nhạc nền - Diệp Lâm Anh,7413027002040568592,https://www.tiktok.com/@dieplamanh/video/7413026935716056327,78,9199,63,352100,252,151,,False,False,dieplamanh,False,False,False,1,0,25,0,0,0,1,0,0
11 giờ khuya em nói có chuyện gấp quan trọng. Xong em lừa tui khi mới đáp về SG chưa được 1 tiếng phải nhanh nhanh chạy về nhà để gặp em “Mỏ Hỗn Xinh” này 🤭 Eo ơiiiii @Nguyen Cao Ky Duyen ,2024-09-06 22:32:24,06/09/2024,False,https://www.tiktok.com/@dieplamanh,nhạc nền - Diệp Lâm Anh,7411553784695884561,https://www.tiktok.com/@dieplamanh/video/7411553363940101394,103,68400,622,2300000,1488,255,,False,False,dieplamanh,False,False,False,1,0,42,0,0,0,0,1,0
Ngoan xinh sẽ được Cún yêu 😝💗 #dieplamanh #vickylamcuc #bestfriend @VICKY LAMCUC (Daily) ,2024-09-03 14:36:21,03/09/2024,False,https://www.tiktok.com/@dieplamanh,d o l c e a n d g a b b a n a,6781550750406413062,https://www.tiktok.com/@dieplamanh/video/7410317411808824594,123,68200,391,1900000,1322,214,"dieplamanh, vickylamcuc, bestfriend, ",False,False,dieplamanh,False,False,False,1,3,9,0,0,1,0,0,0
Tháng 9 dư xăng nhé cả nhà ui 🏊🏻‍♀️🫶🏻 #dieplamanh #september #xinhbagai #waterpark #cuncun ,2024-09-02 18:45:38,02/09/2024,False,https://www.tiktok.com/@dieplamanh,September,6717484596050528258,https://www.tiktok.com/@dieplamanh/video/7410010546197613840,28,14800,101,473200,462,137,"dieplamanh, september, xinhbagai, waterpark, cuncun",False,False,dieplamanh,False,False,True,3,5,9,0,0,0,1,0,0
Tâm trạng khi chuẩn bị được ngắm các em bé đẹp của Cún 😝💗 #dieplamanh #dance #mamushi #tiktokgiaitri #freestyle ,2024-09-01 21:59:12,01/09/2024,False,https://www.tiktok.com/@dieplamanh,Mamushi (feat. Yuki Chiba),7385401177967577104,https://www.tiktok.com/@dieplamanh/video/7409689360704048400,18,51000,379,894200,1669,292,"dieplamanh, dance, mamushi, tiktokgiaitri, freestyle",False,False,dieplamanh,False,False,False,1,5,13,0,0,0,1,0,1
Sau hơn 1 phút này tại MUV thì Anh tắt tiếng cũng được 🥹 Đã đẹp lại còn đi cạnh nhau thứ gì chịu nổi em ơi! #muv #nguyencaokyduyen #mlee ❤️‍🔥❤️‍🔥❤️‍🔥,2024-08-31 21:19:10,31/08/2024,False,https://www.tiktok.com/@dieplamanh,nhạc nền - Diệp Lâm Anh,7409309263258716944,https://www.tiktok.com/@dieplamanh/video/7409307946003270929,73,33600,230,726000,546,292,"muv, nguyencaokyduyen, mlee",False,False,dieplamanh,False,False,False,5,3,27,0,0,0,1,0,1
Ngoài những lúc ồn ơi là ồn 😆 #dieplamanh #ninhduonglanngoc #trangphap #huyenbaby #khongtuquynh #lunas #sol ,2024-08-31 10:47:51,31/08/2024,False,https://www.tiktok.com/@dieplamanh,nhạc nền - Diệp Lâm Anh,7409145343469718289,https://www.tiktok.com/@dieplamanh/video/7409145267703893264,13,6578,121,235500,391,86,"dieplamanh, ninhduonglanngoc, trangphap, huyenbaby, khongtuquynh, lunas, sol",False,False,dieplamanh,False,False,False,1,7,7,0,1,0,0,0,1
Đổ bê tông lấy sức cà hẩy 🤭 #dieplamanh #lunas #sol ,2024-08-29 20:49:03,29/08/2024,True,https://www.tiktok.com/@dieplamanh,nhạc nền - Diệp Lâm Anh,7408558179002419969,https://www.tiktok.com/@dieplamanh/video/7408558044897905921,39,31000,249,939800,933,263,"dieplamanh, lunas, sol",False,False,dieplamanh,False,False,False,1,3,7,0,0,0,1,0,0
Đạt target 🍻 #dieplamanh #khavu #dance ,2024-08-25 00:45:25,24/08/2024,True,https://www.tiktok.com/@dieplamanh,nhạc nền - Diệp Lâm Anh,7406763560976681745,https://www.tiktok.com/@dieplamanh/video/7406763509532478737,21,19900,138,544700,682,144,"dieplamanh, khavu, dance",False,False,dieplamanh,False,False,False,1,3,2,1,0,0,0,0,1
Năm nay khum tổ chức SN nên bị đánh úp nhiều lần 😂 Cảm ơn em yêu @Dương Hữu Nghĩa #dieplamanh #birthday 🎂🫶🏻,2024-08-23 18:10:48,23/08/2024,True,https://www.tiktok.com/@dieplamanh,nhạc nền - Diệp Lâm Anh,7406290831243954945,https://www.tiktok.com/@dieplamanh/video/7406290737945660673,108,5914,151,186900,351,100,", dieplamanh, birthday",False,False,dieplamanh,False,False,True,2,2,19,0,0,0,1,0,0
Có bao nhiêu trái tim màu tím… to đùn 💜💜💜💜💜 Cảm ơn tất cả các em đã ở bên Cún! #dieplamanh #fcdieplamanh #cuncunteam #cuncun #xinhbagai ,2024-08-23 11:40:19,23/08/2024,True,https://www.tiktok.com/@dieplamanh,nhạc nền - 𝗡𝗧𝗣 𝗩𝗜𝗡𝗔𝗛𝗢𝗨𝗦𝗘,7378331121588751120,https://www.tiktok.com/@dieplamanh/video/7406190119004179728,56,8395,79,232900,342,143,"dieplamanh, fcdieplamanh, cuncunteam, cuncun, xinhbagai",False,False,dieplamanh,False,False,False,1,5,19,0,1,0,0,0,0
