text,createTime,createTimeISO,isAd,profileUrl,musicName,musicId,webVideoUrl,duration,diggCount,shareCount,playCount,collectCount,commentCount,hashtags,isSlideshow,isSponsored,kol_username,ttSeller,commerceUser,is_trending,emoji_count,hashtag_count,word_count_no_emoji_hashtag,early_morning,morning,afternoon,evening,late_night,is_weekend
✨ Top 10 skincare tips cho ai đang tuổi 20s. Da đẹp không đến từ may mắn — mà từ nhận thức đúng 🧠 và hành động sớm! #tomskincare #skincaretips #goclamdep #chamsocda #skintok ,2025-05-31 17:05:14,31/05/2025,False,https://www.tiktok.com/@tomskincare,nhạc nền - tomskincare,7510548843470031633,https://www.tiktok.com/@tomskincare/video/7510548790361804050,110,10700,460,193500,2806,385,"tomskincare, skincaretips, goclamdep, chamsocda, skintok",False,False,tomskincare,False,True,False,2,5,26,0,0,1,0,0,1
"Các sản phẩm skincare nổi tiếng, dịu nhẹ, hiệu quả cho da, rất nổi tiếng mà mình luôn mang theo mỗi khi travel 🧳 😍😍😍❤️ #tomskincare #skincaretips #goclamdep #skintok #chamsocda #beautytoks ",2025-05-27 15:39:49,27/05/2025,False,https://www.tiktok.com/@tomskincare,nhạc nền - tomskincare,7509042647638592257,https://www.tiktok.com/@tomskincare/video/7509042435448720647,124,21900,530,477000,6501,447,"tomskincare, skincaretips, goclamdep, skintok, chamsocda, beautytoks",False,False,tomskincare,False,True,False,2,6,24,0,0,1,0,0,0
"🔥 TOP 10 CÂU HỎI VỀ MỤN ẨN – GIẢI ĐÁP TỪ A-Z
Mụn ẩn dai dẳng, sần sùi mãi không hết? Video này là hướng dẫn đặc biệt dành cho bạn!

Tom đã tổng hợp những câu hỏi được hỏi NHIỀU NHẤT trên kênh của mình về trị mụn ẩn và hướng dẫn cách xử lý khoa học, không cảm tính. #tomskincare #skincaretips #goclamdep #beautytok #skintok ",2025-05-26 16:30:25,26/05/2025,False,https://www.tiktok.com/@tomskincare,nhạc nền - tomskincare,7508684446229465857,https://www.tiktok.com/@tomskincare/video/7508684396405247250,363,6259,215,147300,2261,215,"tomskincare, skincaretips, goclamdep, beautytok, skintok",False,False,tomskincare,False,True,False,1,5,61,0,0,1,0,0,0
"4 ""thần dược"" phục hồi da giúp skincare giống như một lựa chọn yêu bản thân, yêu cái đẹp, thú vị, không rủi ro, không tốn kém, và quan trọng hơn cả là chúng đều thực sự hiệu quả để giúp bạn glow up! Nhớ làm theo và cùng nhau đẹp hơn mỗi ngày nha! #tomskincare #skincaretips #goclamdep #beautytok #skintok #chamsocda ",2025-05-24 16:34:46,24/05/2025,False,https://www.tiktok.com/@tomskincare,nhạc nền - tomskincare,7507943386012240641,https://www.tiktok.com/@tomskincare/video/7507943348095765778,203,8382,276,171400,1665,300,"tomskincare, skincaretips, goclamdep, beautytok, skintok, chamsocda",False,False,tomskincare,False,True,False,0,6,55,0,0,1,0,0,1
"2 kiểu ""mụn ẩn"" sần sùi liti thường gặp và có thể tự xử lý tại nhà, cùng chia sẻ case của Tom để mọi người tham khảo nhaaa 😍😍 Ai đang bị thì xin 1 cánh tay ✋✋✋. #tomskincare #skincaretips #goclamdep #beautytok #skintok ",2025-05-22 16:22:36,22/05/2025,False,https://www.tiktok.com/@tomskincare,nhạc nền - tomskincare,7507198069964901137,https://www.tiktok.com/@tomskincare/video/7507198042303401223,98,19100,669,381500,5331,474,"tomskincare, skincaretips, goclamdep, beautytok, skintok",False,False,tomskincare,False,True,False,2,5,38,0,0,1,0,0,0
"Bạn có thể bảo tôi bạn thích sản phẩm skincare giá cao, nhưng thật ra có nhiều sản phẩm rẻ mà cũng rất tốt đó nha! Đây là top 12 sản phẩm skincare giá rẻ nhưng bổ và ngon. Thử ngay nếu tài chính của bạn cho phép! Nhớ xem kỹ video để biết liệu da của bạn có phù hợp ko nhé' #tomskincare #skincaretips #goclamdep #beautytok #skintok ",2025-05-19 17:35:46,19/05/2025,False,https://www.tiktok.com/@tomskincare,nhạc nền - tomskincare,7506103889083550480,https://www.tiktok.com/@tomskincare/video/7506103639396650247,244,24500,1228,446400,9478,638,"tomskincare, skincaretips, goclamdep, beautytok, skintok",False,False,tomskincare,False,True,False,0,5,63,0,0,1,0,0,0
10 sai lầm skincare cho da dầu mụn vào mùa hè và 10 bí quyết skincare đúng cách cho hệ da dầu mụn nhaaaa.......... 😍😍😍 #tomskincare #skincaretips #goclamdep #beautytok #skintok ,2025-05-13 17:24:16,13/05/2025,False,https://www.tiktok.com/@tomskincare,nhạc nền - tomskincare,7503874210889042704,https://www.tiktok.com/@tomskincare/video/7503874167108898066,238,21800,1058,445700,7284,612,"tomskincare, skincaretips, goclamdep, beautytok, skintok",False,False,tomskincare,False,True,False,1,5,24,0,0,1,0,0,0
✨10 tips skincare hiệu quả ít người biết mà cực kỳ tiết kiệm nha mn ơi!!! Ai còn tips nào hay ho comment bên dưới cho mn biết nhaaaa  😍😍😍#tomskincare #skincaretips #goclamdep #beautytok #skintok ,2025-05-09 17:53:59,09/05/2025,False,https://www.tiktok.com/@tomskincare,nhạc nền - tomskincare,7502397525610056449,https://www.tiktok.com/@tomskincare/video/7502397485348965639,195,22900,1068,382200,7754,393,"tomskincare, skincaretips, goclamdep, beautytok, skintok",False,False,tomskincare,False,True,False,2,5,29,0,0,1,0,0,0
"Đã từng nghĩ không thể hết mụn ẩn… cho đến khi tìm ra 7 bước skincare thuộc dạng bí kíp này. Ai đang vật lộn với da sần, mụn ẩn, da nhạy cảm hãy xem tới cuối nha! Cứ hỏi nếu bạn có câu hỏi!!! #tomskincare #skincaretips #goclamdep #beautytok #skintok ",2025-04-29 14:55:18,29/04/2025,False,https://www.tiktok.com/@tomskincare,nhạc nền - tomskincare,7498641187666987792,https://www.tiktok.com/@tomskincare/video/7498640584488357127,264,28100,1062,661500,11300,729,"tomskincare, skincaretips, goclamdep, beautytok, skintok",False,False,tomskincare,False,True,False,0,5,45,0,0,1,0,0,0
8 điều mình không còn làm nữa khi skincare để da đẹp hơn và 8 bí kíp chăm sóc da mình nghĩ là mình sẽ không gatekeep mà muốn mọi người làm theoo... Cùng thử nhaaaa ✨😍 #tomskincare #skincaretips #goclamdep #beautytok #skintok ,2025-04-26 17:13:22,26/04/2025,False,https://www.tiktok.com/@tomskincare,nhạc nền - tomskincare,7497563337673853712,https://www.tiktok.com/@tomskincare/video/7497562912676941064,291,42500,1536,809600,9663,573,"tomskincare, skincaretips, goclamdep, beautytok, skintok",False,False,tomskincare,False,True,False,1,5,36,0,0,1,0,0,1
#tomskincare #skincaretips #goclamdep #beautytok #skintok ,2025-04-23 17:06:42,23/04/2025,False,https://www.tiktok.com/@tomskincare,nhạc nền - tomskincare,7496449014913682192,https://www.tiktok.com/@tomskincare/video/7496447935387831560,143,8120,141,213900,875,283,"tomskincare, skincaretips, goclamdep, beautytok, skintok",False,False,tomskincare,False,True,False,0,5,0,0,0,1,0,0,0
"8 bí quyết skincare giúp giảm thâm mụn và làm sáng, đều màu da hiệu quả. Những tiíp skincare này mình dựa trên hiểu biết của bản thân và trải nghiệm thực tế! #tomskincare #skincaretips #goclamdep #beautytok #skintok ",2025-04-18 16:53:56,18/04/2025,False,https://www.tiktok.com/@tomskincare,nhạc nền - tomskincare,7494589362203151121,https://www.tiktok.com/@tomskincare/video/7494589211077610770,408,8500,283,316200,2843,188,"tomskincare, skincaretips, goclamdep, beautytok, skintok",False,False,tomskincare,False,True,False,0,5,33,0,0,1,0,0,0
"7 lý do skincare và trị mụn nhưng dùng gì cũng không work trên da! Mình là người có trải nghiệm + kinh nghiệm và một mớ kiến thức về vấn đề mụn, vì vậy mn phải tin mình 🥲. Hy vọng video này có ích! #tomskincare #skincaretips #goclamdep #beautytok #skintok ",2025-04-16 16:30:01,16/04/2025,False,https://www.tiktok.com/@tomskincare,nhạc nền - tomskincare,7493842571010444033,https://www.tiktok.com/@tomskincare/video/7493840889509383431,349,52300,2139,875800,11300,950,"tomskincare, skincaretips, goclamdep, beautytok, skintok",False,False,tomskincare,False,True,False,1,5,46,0,0,1,0,0,0
Hướng dẫn 7 bước skincare cho mọi lứa tuổi cũng là những bí quyết skincare giúp bạn tránh lãng phí công sức và tiền bạc... Hy vọng với video này mọi người có thêm mindset để yêu bản thân hơn khi skincare và vì vậy có được hiệu quả thực sự khi skincare!!! #tomskincare #skincaretips #goclamdep #beautytok #skintok ,2025-04-11 16:25:45,11/04/2025,False,https://www.tiktok.com/@tomskincare,nhạc nền - tomskincare,7491984906865593104,https://www.tiktok.com/@tomskincare/video/7491984358505581832,389,9653,389,234600,2616,373,"tomskincare, skincaretips, goclamdep, beautytok, skintok",False,False,tomskincare,False,True,False,0,5,53,0,0,1,0,0,0
"5 bí quyết skincare mà bạn cần nhớ khi chọn đồ skincare trong bước đầu tiên của routine!!! Nó không những giúp bạn làm sạch, mà thật sự có thể nâng tầm cuộc chơi skincare của bạn nếu bạn biết dùng nó thông minh, đúng cách. Đây là vài tips mình đã đúc kết. Hy vọng mọi người có thêm 1 video hữu ích nha! #tomskincare #skincaretips #goclamdep #beautytok #skintok ",2025-04-03 17:57:41,03/04/2025,False,https://www.tiktok.com/@tomskincare,nhạc nền - tomskincare,7489039392732990213,https://www.tiktok.com/@tomskincare/video/7489039359958617399,428,21500,875,527700,6019,555,"tomskincare, skincaretips, goclamdep, beautytok, skintok",False,False,tomskincare,False,True,False,0,5,65,0,0,1,0,0,0
7 lỗi sai skincare khiến mụn bùng và 7 tips skincare giúp bạn khắc phục chúng đến từ tuiii!! 😍😍😍 Mình rất mong mọi người mau khỏi và tự tin hơn với làn da khoẻ mạnh nha 😍❤️ #tomskincare #skincaretips #goclamdep #beautytok #skintok ,2025-03-25 16:48:04,25/03/2025,False,https://www.tiktok.com/@tomskincare,nhạc nền - tomskincare,7485682225850190608,https://www.tiktok.com/@tomskincare/video/7485681656666344722,296,26000,1561,615400,5887,505,"tomskincare, skincaretips, goclamdep, beautytok, skintok",False,False,tomskincare,False,True,False,2,5,37,0,0,1,0,0,0
5 bí quyết làm sạch da đúng cách (với dầu tẩy trang) và cách chọn dầu tẩy trang khi skincare sao cho không bị bùng mụn nhìn từ góc độ trải nghiệm và khoa học kết hợp #tomskincare #skincaretips #goclamdep #beautytok #skintok ,2025-03-12 13:11:36,12/03/2025,False,https://www.tiktok.com/@tomskincare,nhạc nền - tomskincare,7480802621020736257,https://www.tiktok.com/@tomskincare/video/7480801762874641671,392,23100,854,655400,7201,514,"tomskincare, skincaretips, goclamdep, beautytok, skintok",False,False,tomskincare,False,True,False,0,5,37,0,0,1,0,0,0
"Dưỡng da hay skincare thì ko trị được mụn, nhưng mụn trứng cá trên nền da viêm nhạy cảm thì ngoài trị mụn với prescription, mn cần phải chăm sóc da (phục hồi các chức năng của da giảm viêm) nhé!!! Mình đưa ra gợi ý theo trải nghiệm vì vậy mn cân nhắc tham khảo nha! #tomskincare #skincaretips #goclamdep #skintok ",2025-02-28 16:27:31,28/02/2025,False,https://www.tiktok.com/@tomskincare,nhạc nền - tomskincare,7476400957937535745,https://www.tiktok.com/@tomskincare/video/7476399222959475975,242,31000,1892,879000,8244,771,"tomskincare, skincaretips, goclamdep, skintok",False,False,tomskincare,False,True,False,0,4,57,0,0,1,0,0,0
Top 1 sản phẩm skincare mình không thể sống thiếu ạ 😚😚😚 #tomskincare #skincaretips #goclamdep #skintok #beautytok ,2025-02-26 17:18:10,26/02/2025,False,https://www.tiktok.com/@tomskincare,nhạc nền - tomskincare,7475670400828066577,https://www.tiktok.com/@tomskincare/video/7475670124268145938,109,9618,379,474700,2478,469,"tomskincare, skincaretips, goclamdep, skintok, beautytok",False,False,tomskincare,False,True,False,1,5,11,0,0,1,0,0,0
Kem dưỡng da giá rẻ mà tốt!!! Phù hợp da mất nước và loại da khô. Phù hợp với da có hàng rào bảo vệ bị tổn thương. Tom sẽ lên top dưỡng cho da dầu mà bị nhạy cảm sau nhe mn! 😍😍😍 #tomskincare #skincaretips #goclamdep #skintok #beautytok ,2025-02-21 16:07:41,21/02/2025,False,https://www.tiktok.com/@tomskincare,nhạc nền - tomskincare,7473796968872659713,https://www.tiktok.com/@tomskincare/video/7473796525890473223,197,6352,174,355900,1630,311,"tomskincare, skincaretips, goclamdep, skintok, beautytok",False,False,tomskincare,False,True,False,1,5,43,0,0,1,0,0,0
"5 bước trị mụn ẩn tại nhà... Mụn ẩn, mụn sần li ti, texture da luôn là vấn đề nan giải nhất là đối với da dầu trong điều kiện thời tiết hanh khô lại gặp tình trạng mất nước! Nền da nhat cảm lại càng khó! Hy vọng với video và kinh nghiệm tự trị mụn ẩn của Tom sẽ giúp mọi người khắc phục một phần và có làn da đẹp hơn!!!  #tomskincare #skincaretips #goclamdep #skintok #beautytok ",2025-02-19 16:08:03,19/02/2025,False,https://www.tiktok.com/@tomskincare,nhạc nền - tomskincare,7473055347013880577,https://www.tiktok.com/@tomskincare/video/7473054454602927367,412,62800,2925,1200000,23400,945,"tomskincare, skincaretips, goclamdep, skintok, beautytok",False,False,tomskincare,False,True,False,0,5,74,0,0,1,0,0,0
,2025-02-03 18:25:28,03/02/2025,False,https://www.tiktok.com/@tomskincare,original sound - tomskincare,7467152818643061521,https://www.tiktok.com/@tomskincare/video/7467152506276121864,221,85400,2330,1300000,14200,1448,,False,False,tomskincare,False,True,False,0,0,0,0,0,0,1,0,0
Được mệnh danh là top 1 kem chống nắng cho da dầu nên là cùng review với tomskincare nha mọi người! Mỗi người một làn da và điều kiện hoàn cảnh khác nhau nên ý kiến của mình chỉ mang tính tham khảo! #tomskincare #skincaretips #goclamdep #skintok #beautytok ,2025-01-17 16:23:10,17/01/2025,False,https://www.tiktok.com/@tomskincare,nhạc nền - tomskincare,7460812576901958417,https://www.tiktok.com/@tomskincare/video/7460812542789553415,139,6723,185,467800,1284,328,"tomskincare, skincaretips, goclamdep, skintok, beautytok",False,False,tomskincare,False,True,False,0,5,43,0,0,1,0,0,0
"Top 5 chai serum đáng mua nhất trong tầm giá trung 🍠🔥. Thật sự là không phải nghĩ vì ngoài công nghệ sịn, những em này toàn chất bổ béo cho da 😍🫂🔥 #tomskincare #skincaretips #goclamdep #skintok ",2025-01-06 17:32:17,06/01/2025,False,https://www.tiktok.com/@tomskincare,nhạc nền - tomskincare,7456748513738246928,https://www.tiktok.com/@tomskincare/video/7456748413724478728,300,9777,362,540100,3659,623,"tomskincare, skincaretips, goclamdep, skintok",False,False,tomskincare,False,True,False,2,4,32,0,0,1,0,0,0
Top 13 kem chống nắng giá rẻ hot nhất tiktok 2024. Cùng xem 2025 nhưng em kem nắng nào còn duy trì được độ hot nhé mn! Hãy cho tomskincare biết suy nghĩ của bạn bên dưới nha! 🫡🫡🫡🔥😍 #tomskincare #skincaretips #goclamdep #beautytok #skintok ,2025-01-05 16:57:15,05/01/2025,False,https://www.tiktok.com/@tomskincare,nhạc nền - tomskincare,7456368425556806401,https://www.tiktok.com/@tomskincare/video/7456368300759534855,203,39800,1002,1400000,6961,1333,"tomskincare, skincaretips, goclamdep, beautytok, skintok",False,False,tomskincare,False,True,False,1,5,38,0,0,1,0,0,1
Đừng mắc phải 5 tội lỗi skincare này nhé!!! 🥹🥹🥹 Ko hiểu được sự cơ bản cũng khó để tự chăm sóc da hiệu quả!!! Chúc mọi người da đẹpppp #tomskincare #skincaretips #goclamdep #beautytok #skintok ,2025-01-03 17:20:48,03/01/2025,False,https://www.tiktok.com/@tomskincare,nhạc nền - tomskincare,7455632381433629456,https://www.tiktok.com/@tomskincare/video/7455632196704029959,233,25300,610,775400,2519,441,"tomskincare, skincaretips, goclamdep, beautytok, skintok",False,False,tomskincare,False,True,False,1,5,29,0,0,1,0,0,0
Tri ân các bạn đã xem tomskincare với 5 bí quyết này!! Tom nghĩ chúng là chân ái!! Bạn thì sao?? 😻😻 #tomskincare #skincaretips #goclamdep #beautytok #skintok ,2024-12-26 16:03:55,26/12/2024,False,https://www.tiktok.com/@tomskincare,nhạc nền - tomskincare,7452643890462526209,https://www.tiktok.com/@tomskincare/video/7452643696006188296,350,36600,737,798700,5608,686,"tomskincare, skincaretips, goclamdep, beautytok, skintok",False,False,tomskincare,False,True,False,1,5,21,0,0,1,0,0,0
"8 lỗi sai skincare mà người mới bắt đầu hay lâu năm cũng cần biết để tránh nha 😍😍😍 Hãy chọn cho mình routine skincare phù hợp với da, đừng gặp những sai lầm như mình từng mắc!  #tomskincare #skincaretips #goclamdep #beautytok #skintok ",2024-12-14 16:21:33,14/12/2024,False,https://www.tiktok.com/@tomskincare,nhạc nền - tomskincare,7448195524710140673,https://www.tiktok.com/@tomskincare/video/7448195222145715474,267,13200,326,494800,2013,469,"tomskincare, skincaretips, goclamdep, beautytok, skintok",False,False,tomskincare,False,True,False,1,5,37,0,0,1,0,0,1
7 hiểu lầm về skincare khiến việc skincare không còn thua vị và thậm chí làm da của các bạn tệ hơn! Hãy hiểu đúng hơn và có làn da khoẻ mạnh trong 2025 nhé!!! #tomskincare #skincaretips ##goclamdep##beautytok##skintok,2024-12-09 17:54:04,09/12/2024,False,https://www.tiktok.com/@tomskincare,original sound - tomskincare,7446363701080443649,https://www.tiktok.com/@tomskincare/video/7446363646713695495,447,39000,1709,1000000,6678,512,"tomskincare, skincaretips, goclamdep, beautytok, skintok",False,False,tomskincare,False,True,False,0,5,36,0,0,1,0,0,0
Top 6 chấm mụn đỉnh của chóp bạn nên biết qua để rút ngắn thời gian viêm của mụn và giúp trị mụn nhanh! 😍 #tomskincare #skincaretips #goclamdep #beautytok #skintok ,2024-12-06 17:13:03,06/12/2024,False,https://www.tiktok.com/@tomskincare,nhạc nền - tomskincare,7445240000814271233,https://www.tiktok.com/@tomskincare/video/7445239820865129736,161,28100,1699,882500,11100,767,"tomskincare, skincaretips, goclamdep, beautytok, skintok",False,False,tomskincare,False,True,False,1,5,24,0,0,1,0,0,0
"Hướng dẫn skincare trị mụn đầu đen ở mũi và cằm sao cho đúng cách 🥹😍😅🤣😇
#tomskincare #skincaretips #goclamdep #beautytok #skintok ",2024-12-04 15:35:03,04/12/2024,False,https://www.tiktok.com/@tomskincare,nhạc nền - tomskincare,7444472426475342609,https://www.tiktok.com/@tomskincare/video/7444472398612614418,125,74900,3910,1700000,25000,827,"tomskincare, skincaretips, goclamdep, beautytok, skintok",False,False,tomskincare,False,True,False,1,5,15,0,0,1,0,0,0
"Trị mụn ẩn trong 3 phút, xử lý sạch các loại mụn li ti và hết bối rối không biết phải làm gì! Mình bị mụn ẩn nhiều lắm thậm chí chỉ trong vài tiếng dùng skincare có thể khiến da mình breakout. Hy vọng các bạn thấy vid này hữu ích này! 😘😘 #tomskincare #skincaretips #goclamdep #beautytok #skintok ",2024-12-02 16:45:04,02/12/2024,False,https://www.tiktok.com/@tomskincare,nhạc nền - tomskincare,7443753460861897489,https://www.tiktok.com/@tomskincare/video/7443748268326030599,181,38400,1903,915300,10000,797,"tomskincare, skincaretips, goclamdep, beautytok, skintok",False,False,tomskincare,False,True,False,1,5,53,0,0,1,0,0,0
"Skincare cho lứa tuổi 20s vẫn luôn là yêu bản thân và nâng cao giá trị bản thân! Nhưng bạn thân yêu ạ, làm đẹp là hành trình dài và là khoản đầu tư cho chất lượng sống của bạn ở tương lai 😭🥹. Giá như hồi xưa mình chăm bôi và chịu khó tập luyện hơn 🥲🥲🥲 #tomskincare #skincaretips #goclamdep #beautytok #skintok ",2024-11-29 14:51:00,29/11/2024,False,https://www.tiktok.com/@tomskincare,original sound - tomskincare,7442605687529540353,https://www.tiktok.com/@tomskincare/video/7442605614427065608,140,8718,245,333100,889,253,"tomskincare, skincaretips, goclamdep, beautytok, skintok",False,False,tomskincare,False,True,False,2,5,57,0,0,1,0,0,0
6 sai lầm skincare ai cũng mắc nhưng khiến da kích ứng hoặc bùng mụn. Và mình có nói thêm về tips của mình trong đây. Chúc bạn luôn có làn da đẹp 😙😙😊😊😍🥰 #tomskincare #skincaretips #goclamdep #beautytok #skintok ,2024-11-25 15:57:57,25/11/2024,False,https://www.tiktok.com/@tomskincare,nhạc nền - tomskincare,7441138569151925009,https://www.tiktok.com/@tomskincare/video/7441138529771588872,233,17700,646,432300,2028,383,"tomskincare, skincaretips, goclamdep, beautytok, skintok",False,False,tomskincare,False,True,False,1,5,33,0,0,1,0,0,0
Top 15 sản phẩm hot hit nhất định phải thử 1 lần trong đời 🤣🤣🤣 #tomskincare #skincaretips #goclamdep #beautytok ,2024-11-22 17:13:40,22/11/2024,False,https://www.tiktok.com/@tomskincare,nhạc nền - tomskincare,7440045272816077569,https://www.tiktok.com/@tomskincare/video/7440044785630579976,342,38300,891,784200,10100,736,"tomskincare, skincaretips, goclamdep, beautytok",False,False,tomskincare,False,True,False,1,4,14,0,0,1,0,0,0
TOP 10 tips skincare cho da dầu mụn để giảm mụn ngừa mụn dành cho mọi lứa tuổi. Mn cứ làm đúng những gì vid này nói xem sao ;) Mình nghĩ nó đã là rất an toàn nhưng vẫn đảm bảo hiệu quả cho mn rùi nhaaa. Chúc mn thành công da đẹp 🥰😍 #tomskincare #skincaretips #g#goclamdepb#beautytoks#skintok,2024-11-18 17:05:27,18/11/2024,False,https://www.tiktok.com/@tomskincare,nhạc nền - tomskincare,7438560074802547457,https://www.tiktok.com/@tomskincare/video/7438558323475057938,348,40900,1730,752100,14600,554,"tomskincare, skincaretips, g, goclamdepb, beautytoks, skintok",False,False,tomskincare,False,True,False,1,6,54,0,0,1,0,0,0
Tăng sắc tố sau mụn (thâm đỏ thâm đen sau mụn trứng cá) là vấn đề được hỏi rất nhiều nên mình làm một video trả lời cho tất cả mn một lượt nha 🥲🥲 ✨ Chúc mọi người có da khoẻ da đẹp! #tomskincare #skincaretips #goclamdep #beautytok #skintok ,2024-11-17 16:48:58,17/11/2024,False,https://www.tiktok.com/@tomskincare,original sound - tomskincare,7438183768961075984,https://www.tiktok.com/@tomskincare/video/7438182997691485458,552,19100,920,450900,7820,445,"tomskincare, skincaretips, goclamdep, beautytok, skintok",False,False,tomskincare,False,True,False,2,5,42,0,0,1,0,0,1
10 sai lầm skincare lớn nhất khiến mụn mãi không khỏi. Mình rất hiểu tâm lý bị mụn hoặc trị mụn mãi ko khỏi nhưng đây là lúc để chúng ta nhìn lại xem có mắc phải lỗi sai gì khiến mụn trở nên dai dẳng cứng đầu không nhé! 🥺😍😍 Chúc mn có làn da đẹp khoẻ! #tomskincare #skincaretips #goclamdep ##beautytok#s#skintok,2024-11-04 17:39:39,04/11/2024,False,https://www.tiktok.com/@tomskincare,original sound - tomskincare,7433372814062979857,https://www.tiktok.com/@tomskincare/video/7433371942419254546,501,23800,917,521300,5269,643,"tomskincare, skincaretips, goclamdep, beautytok, skintok",False,False,tomskincare,False,True,False,1,6,58,0,0,1,0,0,0
"Top các sản phẩm dành cho da nhạy cảm và phục hồi da kích ứng. Chúng đặc biệt phù hợp khi da gặp tình trạng rất yếu, breakouts... Khi da của các bạn khoẻ hơn hãy nghĩ đến các sản phẩm skincare khác nữa nhé! #tomskincare #skincaretips #beautytok #goclamdep #skintok ",2024-11-01 18:16:02,01/11/2024,False,https://www.tiktok.com/@tomskincare,original sound - tomskincare,7432268179159763728,https://www.tiktok.com/@tomskincare/video/7432268064885918994,308,20000,914,611200,5591,610,"tomskincare, skincaretips, beautytok, goclamdep, skintok",False,False,tomskincare,False,True,False,0,5,45,0,0,0,1,0,0
Hướng dẫn đắp mask phục hồi da sao cho đúng cách =))))) #tomskincare #skincaretips #beautytok #goclamdep #skintok ,2024-10-29 16:37:31,29/10/2024,False,https://www.tiktok.com/@tomskincare,original sound - tomskincare,7431131371680746257,https://www.tiktok.com/@tomskincare/video/7431129428677102866,294,28200,1258,748500,4796,720,"tomskincare, skincaretips, beautytok, goclamdep, skintok",False,False,tomskincare,False,True,False,0,5,12,0,0,1,0,0,0
8 sản phẩm skincare hot trend trong thời gian qua và sau đây là quan điểm của mình... #tomskincare #skincaretips #beautytok #goclamdep #skintok ,2024-10-28 15:32:42,28/10/2024,False,https://www.tiktok.com/@tomskincare,original sound - tomskincare,7430741691134741264,https://www.tiktok.com/@tomskincare/video/7430741633156648210,346,11700,172,419400,1854,424,"tomskincare, skincaretips, beautytok, goclamdep, skintok",False,False,tomskincare,False,True,True,0,5,18,0,0,1,0,0,0
Top 15 kem dưỡng ẩm cho da dầu mụn... Cùng chọn skincare cho da dầu mụn mùa hanh khô nhé mọi người! #tomskincare #skincaretips #beautytok #goclamdep #skintok ,2024-10-23 20:51:21,23/10/2024,False,https://www.tiktok.com/@tomskincare,nhạc nền - tomskincare,7428968375243524865,https://www.tiktok.com/@tomskincare/video/7428968329550793991,298,31800,1348,1200000,9089,1265,"tomskincare, skincaretips, beautytok, goclamdep, skintok",False,False,tomskincare,False,True,False,0,5,22,0,0,0,1,0,0
