text,createTime,createTimeISO,isAd,profileUrl,musicName,musicId,webVideoUrl,duration,diggCount,shareCount,playCount,collectCount,commentCount,hashtags,isSlideshow,isSponsored,kol_username,ttSeller,commerceUser,is_trending,emoji_count,hashtag_count,word_count_no_emoji_hashtag,early_morning,morning,afternoon,evening,late_night,is_weekend
"Top 13 sản phẩm skincare yêu thích của mình mà mình mua đi mua lại 😂😂. Vẫn còn vài sản phẩm nữa nhưng khó tìm và cũng chưa thật sự phù hợp với đa số, nên mình sẽ up lên sau! #tomskincare #beautytok #goclamdep #skintok #skincaretips ",2024-10-15 16:42:35,15/10/2024,False,https://www.tiktok.com/@tomskincare,original sound - tomskincare,7425936345484249872,https://www.tiktok.com/@tomskincare/video/7425935530220719368,211,34200,1010,961600,11900,961,"tomskincare, beautytok, goclamdep, skintok, skincaretips",False,False,tomskincare,False,True,False,1,5,41,0,0,1,0,0,0
Top 30 sản phẩm trị mụn và hỗ trợ trị mụn. Hãy cùng xem để biết da nào và tổn thương mụn nào sẽ phù hợp với sản phẩm nào bạn nhé! #tomskincare #beautytok #goclamdep #skintok #skincaretips ,2024-10-13 17:40:46,13/10/2024,False,https://www.tiktok.com/@tomskincare,nhạc nền - tomskincare,7425208757128317712,https://www.tiktok.com/@tomskincare/video/7425208358036131090,499,35100,1994,1100000,12200,1485,"tomskincare, beautytok, goclamdep, skintok, skincaretips",False,False,tomskincare,False,True,False,0,5,32,0,0,1,0,0,1
"Top 3 nhóm skincare phục hồi da... Vì phục hồi là phải tuỳ vào nhu cầu da (loại da và tình trạng da). Để chọn lựa skincare đúng cách, hãy hiểu rõ 3 nhóm sản phẩm này nha ✨✨✨#tomskincare #beautytok #goclamdep #skintok #skincaretips ",2024-10-12 17:34:35,12/10/2024,False,https://www.tiktok.com/@tomskincare,original sound - tomskincare,7424835893213235969,https://www.tiktok.com/@tomskincare/video/7424835683384036626,424,12100,399,366600,3753,276,"tomskincare, beautytok, goclamdep, skintok, skincaretips",False,False,tomskincare,False,True,False,1,5,38,0,0,1,0,0,1
Top 9 skincare rẻ mà ai cũng có khả năng mua được. HSSV đừng bỏ lỡ. Top này chưa phải tất alcar nha mn. Tom sẽ cố gắng tìm và tổng hợp thêm 😂😂😂 #tomskincare #beautytok #goclamdep #skintok #skincaretips ,2024-10-11 17:17:49,11/10/2024,False,https://www.tiktok.com/@tomskincare,original sound - tomskincare,7424460531660016385,https://www.tiktok.com/@tomskincare/video/7424460277808172306,230,24700,533,530300,5915,500,"tomskincare, beautytok, goclamdep, skintok, skincaretips",False,False,tomskincare,False,True,False,1,5,33,0,0,1,0,0,0
10 skincare tips để giúp các bạn tiết kiệm hơn... Và mình đảm bảo chúng thật sự có ích! Cảm ơn mn đã yêu mến mình thời gian qua 😍 Hãy cho mình biết bạn có câu hỏi gì ở phần bình luận ☺️ #tomskincare #beautytok #goclamdep #skintok #skincaretips ,2024-10-09 17:09:37,09/10/2024,False,https://www.tiktok.com/@tomskincare,original sound - tomskincare,7423716161054853889,https://www.tiktok.com/@tomskincare/video/7423715987993775378,424,44700,1467,681800,13800,396,"tomskincare, beautytok, goclamdep, skintok, skincaretips",False,False,tomskincare,False,True,False,2,5,43,0,0,1,0,0,0
10 dấu hiệu cho thấy bạn đang skincare đúng cách và da của các bạn đang rất đẹp 😇😍. Hãy xem hết để nắm được bí quyết dưỡng da thật sự nhaaaa 💋 #tomskincare #beautytok #goclamdep #skintok #skincaretips ,2024-10-07 16:45:05,07/10/2024,False,https://www.tiktok.com/@tomskincare,original sound - tomskincare,7422967833480612609,https://www.tiktok.com/@tomskincare/video/7422967503019658503,421,33700,705,658700,6138,524,"tomskincare, beautytok, goclamdep, skintok, skincaretips",False,False,tomskincare,False,True,False,2,5,32,0,0,1,0,0,0
5 hiểu lầm skincare về da dầu mụn gần đây rất viral và trend trên tiktok nhưng có thể khiến da dầu mụn tệ hơn nếu không được hiểu đúng. Nó cũng tương ứng với 5 tips skincare mà tom dành cho các bạn da dầu mụn nha! #tomskincare #beautytok #goclamdep #skintok #skincaretips ,2024-09-30 16:17:45,30/09/2024,False,https://www.tiktok.com/@tomskincare,original sound - tomskincare,7420363303907625729,https://www.tiktok.com/@tomskincare/video/7420362858887761170,319,29200,1001,748100,4307,540,"tomskincare, beautytok, goclamdep, skintok, skincaretips",False,False,tomskincare,False,True,True,0,5,48,0,0,1,0,0,0
10 skincare trends rất hot ❌ mà các bạn không nên làm theo để tránh lãng phí tiền thậm chí gây hại cho da... Có rất nhiều lỗi sai skincare mình update trong series Myths. Hy vọng có ích! #tomskincare #skincaretips #goclamdep #beautytok #skintok ,2024-09-23 16:46:32,23/09/2024,False,https://www.tiktok.com/@tomskincare,original sound - tomskincare,7417772836368337665,https://www.tiktok.com/@tomskincare/video/7417772676149808402,408,46700,2933,1000000,6669,745,"tomskincare, skincaretips, goclamdep, beautytok, skintok",False,False,tomskincare,False,True,False,1,5,38,0,0,1,0,0,0
Top 7 lỗi sai cơ bản trong skincare mà có thể các bann trẻ chưa biết. Mình đang cố gắng cứu các bạn để các bạn ko bị giống mình khi các bạn trưởng thành hơn... #tomskincare #skincaretips #goclamdep #beautytok #skintok ,2024-09-16 17:49:19,16/09/2024,False,https://www.tiktok.com/@tomskincare,original sound - tomskincare,7415191375656405777,https://www.tiktok.com/@tomskincare/video/7415191247511506184,261,37300,2540,731000,9739,659,"tomskincare, skincaretips, goclamdep, beautytok, skintok",False,False,tomskincare,False,True,False,0,5,36,0,0,1,0,0,0
Mụn mãi không khỏi và lúc nào cũng toàn mụn viêm nên xem... Chúc các bạn mau hết mụn... Mình ở đây chia sẻ top 13 cách mà mọi người hay dùng nhưng có 3 cách mà mọi người không nên dùng cho mụn nhé! #tomskincare #skincaretips #beautytok #goclamdep #acne ,2024-09-09 14:36:47,09/09/2024,False,https://www.tiktok.com/@tomskincare,original sound - tomskincare,7412544145938074385,https://www.tiktok.com/@tomskincare/video/7412544044200414472,216,26200,1535,592500,7247,664,"tomskincare, skincaretips, beautytok, goclamdep, acne",False,False,tomskincare,False,True,False,0,5,45,0,0,1,0,0,0
"5 bước trị mụn trứng cá, mụn ẩn mà ai cũng nên biết rõ để tự thiết kế routine skincare và trị mụn hiệu quả hơn! #tomskincare #skincaretips #goclamdep #beautytok ",2024-08-27 17:21:25,27/08/2024,False,https://www.tiktok.com/@tomskincare,original sound - tomskincare,7407762569567537937,https://www.tiktok.com/@tomskincare/video/7407762365787229461,350,19900,669,523800,5434,548,"tomskincare, skincaretips, goclamdep, beautytok",False,False,tomskincare,False,True,False,0,4,26,0,0,1,0,0,0
Top 1 mask phục hồi làm sáng đáng mua nhất thời điểm hiện tại (ykr) #tomskincare #reviewskincare #reviewlamdep ,2024-08-24 17:27:26,24/08/2024,False,https://www.tiktok.com/@tomskincare,original sound - tomskincare,7406650817144425232,https://www.tiktok.com/@tomskincare/video/7406650658490715412,109,38200,1189,1100000,6755,674,"tomskincare, reviewskincare, reviewlamdep",False,False,tomskincare,False,True,False,0,3,15,0,0,1,0,0,1
"Đánh giá/ review/ Rating top 10 các thành phần ""vàng"" trong skincare 🤓🤓🤓... (ykr) #tomskincare #reviewskincare #reviewlamdep #beautytok ",2024-08-19 17:36:08,19/08/2024,False,https://www.tiktok.com/@tomskincare,original sound - tomskincare,7404797988470213377,https://www.tiktok.com/@tomskincare/video/7404797476084960528,406,12300,189,406200,2190,431,"tomskincare, reviewskincare, reviewlamdep, beautytok",False,False,tomskincare,False,True,False,1,4,14,0,0,1,0,0,0
Top các skincare giá rẻ cho HSSV! Mình dùng và thấy thích! Chi tiết xem trong vid nha! Hy vọng có ích! #tomskincare #reviewskincare #reviewlamdep ,2024-08-16 20:24:11,16/08/2024,False,https://www.tiktok.com/@tomskincare,original sound - tomskincare,7403727704828824336,https://www.tiktok.com/@tomskincare/video/7403727528772242709,173,65800,1360,1300000,18700,1162,"tomskincare, reviewskincare, reviewlamdep",False,False,tomskincare,False,True,False,0,3,22,0,0,0,1,0,0
"Top 7 hiểu lầm/ lầm tưởng về skincare cần được hiểu đúng hơn để giúp mọi người chăm sóc da đúng cách, chọn sản phẩm skincare phù hợp hơn với bản thân! #tomskincare #goclamdep #skincaretips ",2024-08-12 16:58:21,12/08/2024,False,https://www.tiktok.com/@tomskincare,original sound - tomskincare,7402190480945335057,https://www.tiktok.com/@tomskincare/video/7402190145882950913,403,32200,1083,761700,5342,634,"tomskincare, goclamdep, skincaretips",False,False,tomskincare,False,True,False,0,3,32,0,0,1,0,0,0
Top 6 các serum đáng tiền nhất vừa làm sáng vừa phục hồi mà mình rất yêu thích!! Hy vọng mọi người sẽ tìm được loại serum phù hợp qua video của mình ah ! 😊 #tomskincare #goclamdep #reviewskincare #reviewlamdep ,2024-08-07 18:42:17,07/08/2024,False,https://www.tiktok.com/@tomskincare,original sound - tomskincare,7400361701385734928,https://www.tiktok.com/@tomskincare/video/7400361509559291156,169,10100,222,628900,2724,533,"tomskincare, goclamdep, reviewskincare, reviewlamdep",False,False,tomskincare,False,True,False,1,4,35,0,0,0,1,0,0
"Top 9 sản phẩm skincare ""chống lão hoá"" dưới 500 (rẻ) mà mn có thể tham khảo 🤩😂😂 #tomskincare #goclamdep #reviewskincare ##reviewlamdep",2024-08-05 17:58:44,05/08/2024,False,https://www.tiktok.com/@tomskincare,original sound - tomskincare,7399608156102478608,https://www.tiktok.com/@tomskincare/video/7399608105341832469,201,8042,260,413800,3180,233,"tomskincare, goclamdep, reviewskincare, reviewlamdep",False,False,tomskincare,False,True,False,1,4,18,0,0,1,0,0,0
Replying to @𝒏𝒄🦢  Top 5 các loại serum rau má phục hồi làm dịu da mà mình thích... 😊😊😊 Mình nghĩ mọi ngừoi có thể thử tuỳ vào điều kiện kinh tế của mọi người nhé 🙂‍↕️🙂‍↕️🙂‍↕️ #tomskincare #goclamdep #skincaretips #beautytok #reviewskincare #reviewlamdep ,2024-08-02 16:04:47,02/08/2024,False,https://www.tiktok.com/@tomskincare,original sound - tomskincare,7398465538068843265,https://www.tiktok.com/@tomskincare/video/7398465486234635541,69,35900,1534,1400000,10800,1448,", tomskincare, goclamdep, skincaretips, beautytok, reviewskincare, reviewlamdep",False,False,tomskincare,False,True,False,5,6,36,0,0,1,0,0,0
Top 5 các sản phẩm skincare làm dịu phục hồi da mà tom lun tin tưởng 😊😊😊 ❤️❤️❤️ #tomskincare #goclamdep #skincaretips #beautytok #skintok #reviewskincare #reviewlamdep ,2024-07-29 17:08:48,29/07/2024,False,https://www.tiktok.com/@tomskincare,original sound - tomskincare,7396997681757948688,https://www.tiktok.com/@tomskincare/video/7396997637121035537,117,10500,237,452200,2499,525,"tomskincare, goclamdep, skincaretips, beautytok, skintok, reviewskincare, reviewlamdep",False,False,tomskincare,False,True,False,4,7,17,0,0,1,0,0,0
"Top 3 bí quyết phục hồi da mụn ẩn, đỏ li ti kích ứng breakout hoặc da cần phục hồi. Chúc da mn mau khoẻ với chiếc clip này. Tin mình đi, mình giúp nhiều bạn vượt qua nhờ mấy tips rất đơn giản rùi ạ ❤️❤️🙏✨ #tomskincare #goclamdep #skincaretips #beautytok ",2024-07-22 16:30:37,22/07/2024,False,https://www.tiktok.com/@tomskincare,nhạc nền - tomskincare,7394390242708507408,https://www.tiktok.com/@tomskincare/video/7394390186299329808,148,40300,1092,1200000,13400,981,"tomskincare, goclamdep, skincaretips, beautytok",False,False,tomskincare,False,True,False,3,4,47,0,0,1,0,0,0
"Chỉ là một vài suy nghĩ... Mình muốn các bạn không chỉ học được cách tự giúp bản thân mình khi skincare, tips skincare hoặc tên sản phẩm, mà còn phải có tư duy tự chủ và độc lập khi đánh giá đồ skincare trên da của mình. Mỗi người chỉ có 1 làn da nên hãy yêu và bảo vệ nó 🤗😍🫡 #tomskincare #goclamdep #skintok #skincaretips #beautytok ",2024-07-15 15:46:06,15/07/2024,False,https://www.tiktok.com/@tomskincare,original sound - tomskincare,7391781183677385488,https://www.tiktok.com/@tomskincare/video/7391781126936775956,163,5056,134,336500,618,321,"tomskincare, goclamdep, skintok, skincaretips, beautytok",False,False,tomskincare,False,True,False,1,5,62,0,0,1,0,0,0
Hướng dẫn test loại da trong 7 ngày mà bạn có thể tự làm ở nhà. Việc hiểu rõ da của mình thế nào để chọn đồ skincare là vô cùng quan trọng. Nếu bạn không hiểu da mình thì mọi skincare đều có thể khiến bạn tốn thêm nhiều tiền nha! #tomskincare #goclamdep #skintok #skincaretips #skincare101 ,2024-07-13 16:35:05,13/07/2024,False,https://www.tiktok.com/@tomskincare,original sound - tomskincare,7391051640951884545,https://www.tiktok.com/@tomskincare/video/7391051583980571925,322,18800,819,516400,6358,300,"tomskincare, goclamdep, skintok, skincaretips, skincare101",False,False,tomskincare,False,True,True,0,5,52,0,0,1,0,0,1
Top 19 các sản phẩm skincare làm đẹp ko nên mua vì có thể gây hại hoặc tốn thêm tiền ❌❌❌ Hãy tiết kiệm tiền của bạn cho các sản phẩm chất lượng hơn nhé! #tomskincare #goclamdep #skintok #skincaretips #beautytok ,2024-07-08 16:38:03,08/07/2024,False,https://www.tiktok.com/@tomskincare,original sound - tomskincare,7389196981460568833,https://www.tiktok.com/@tomskincare/video/7389196925687368981,354,57400,3128,1100000,12500,1663,"tomskincare, goclamdep, skintok, skincaretips, beautytok",False,False,tomskincare,False,True,False,1,5,34,0,0,1,0,0,0
Kem chống nắng có thật sự nguy hại và gây ung thư? #tomskincare #goclamdep #skintok #skincaretips ,2024-07-05 17:26:28,05/07/2024,False,https://www.tiktok.com/@tomskincare,original sound - tomskincare,7388096202464185089,https://www.tiktok.com/@tomskincare/video/7388096148147424532,351,3561,176,283700,315,262,"tomskincare, goclamdep, skintok, skincaretips",False,False,tomskincare,False,True,False,0,4,12,0,0,1,0,0,0
Top 10 bí quyết làm đẹp 0₫ hoặc rất rẻ mà ai cũng nên thử. Cảm ơn các bạn 1 năm qua đã yêu mến Tomskincare hihi. Dành tặng những ai yêu làm đẹp! #tomskincare #goclamdep #skincaretips #beautytok ,2024-07-04 17:08:20,04/07/2024,False,https://www.tiktok.com/@tomskincare,original sound - tomskincare,7387720497091349264,https://www.tiktok.com/@tomskincare/video/7387720390413536533,293,46400,1610,831400,17300,418,"tomskincare, goclamdep, skincaretips, beautytok",False,False,tomskincare,False,True,False,0,4,34,0,0,1,0,0,0
"Bí quyết làm đẹp 101: Khoẻ! Hic Đừng ham hố làm trắng để làm gì mọi người ạ! Dĩ nhiên dùng skincare khoa học làm sáng là chấp nhận được để giúp da nám, sạm. Nhưng ngoài đồ bôi, mọi người cần nạp thêm những thông tin cơ bản và hướng dẫn chuyên môn có tâm ❤️ Hy vọng mn sẽ lun khoẻ! #tomskincare #goclamdep #beautytok #skincaretips #skintok ",2024-07-02 17:36:27,02/07/2024,False,https://www.tiktok.com/@tomskincare,original sound - tomskincare,7386985530912688912,https://www.tiktok.com/@tomskincare/video/7386985480509869320,81,5863,93,301100,512,255,"tomskincare, goclamdep, beautytok, skincaretips, skintok",False,False,tomskincare,False,True,False,1,5,63,0,0,1,0,0,0
Top 1 Bí quyết da đẹp mùa hè xin gọi tên bột kiềm dầu. Kem chống nắng mình dùng đều cho hiệu quả mỏng nhẹ mùa hè nha mn ơi 😙😙😍😍😍😍😍 Rất rất thích 10/10 ten outta ten!!!! #tomskincare #goclamdep #skincaretips #reviewskincare #reviewlamdep #skincare ,2024-06-29 14:01:34,29/06/2024,False,https://www.tiktok.com/@tomskincare,Valentina (Speed up),7208937230616758273,https://www.tiktok.com/@tomskincare/video/7385816827357695248,76,7714,120,341000,1456,339,"tomskincare, goclamdep, skincaretips, reviewskincare, reviewlamdep, skincare",False,False,tomskincare,False,True,True,1,6,37,0,0,1,0,0,1
"5 bước đơn giản giảm mụn ẩn, xử lý mụn breakout kích ứng. ✨ Mọi người lưu bí quyết này về dùng thử nhé. 😂Trộm vía lâu rồi không phải gặp bác sĩ dù vẫn thi thoảng có mụn ẩn, mụn viêm hoặc breakout :) 😑. Mn nên tham khảo thêm các vid khác nếu thấy chưa đủ hoặc để lại câu hỏi dưới comment nha! 🧘❤️😍#tomskincare #goclamdep #beautytok #skincaretips #cloggedpores #acneproneskin #acne #munan #skintok ",2024-06-27 16:40:58,27/06/2024,False,https://www.tiktok.com/@tomskincare,original sound - tomskincare,7385115836497185553,https://www.tiktok.com/@tomskincare/video/7385115742674472199,186,22200,651,593900,7099,541,"tomskincare, goclamdep, beautytok, skincaretips, cloggedpores, acneproneskin, acne, munan, skintok",False,False,tomskincare,False,True,True,5,9,66,0,0,1,0,0,0
"Thay đổi cuộc chơi skincare chỉ với 1 bí quyết làm đẹp: Rửa mặt! 😇 Cùng thử nâng cấp chu trình skincare của bạn bắt đầu từ việc làm sạch đúng cách như hướng dẫn của mình nhé! 😍
Trong đây mình cũng nhấn mạnh về việc sử dụng tẩy trang, sữa rửa mặt như là 2 bước bắt buộc. Tuy nhiên nếu bạn không dùng kem chống nắng và makeup thì tẩy trang có thể được cân nhắc là không bắt buộc. Hãy lắng nghe làn da để chọn được phương pháp phù hợp nhé!😅😅😅 #tomskincare #goclamdep #beautytok #skintok #skincaretips ",2024-06-24 18:04:14,24/06/2024,False,https://www.tiktok.com/@tomskincare,original sound - tomskincare,7384023990916565777,https://www.tiktok.com/@tomskincare/video/7384023932736752897,198,15600,404,538800,4442,396,"tomskincare, goclamdep, beautytok, skintok, skincaretips",False,False,tomskincare,False,True,False,3,5,94,0,0,0,1,0,0
Top sản phẩm phục hồi dịu nhẹ khá hợp mùa hè. Các sản phẩm skincare này Tom rất rất thích vì dùng thấy hiệu quả trong mùa hè 😅😅😅 Mn có thể thử nếu có da giống tom nha! 😙😊 #tomskincare #goclamdep #beautytok #skintok #reviewskincare #reviewlamdep ,2024-06-22 18:04:29,22/06/2024,False,https://www.tiktok.com/@tomskincare,original sound - tomskincare,7383281894966397712,https://www.tiktok.com/@tomskincare/video/7383281829501046033,124,8705,158,383900,2141,454,"tomskincare, goclamdep, beautytok, skintok, reviewskincare, reviewlamdep",False,False,tomskincare,False,True,True,2,6,38,0,0,0,1,0,1
10 nguyên nhân gây ra mụn mà có thể bạn không hề biết. Mụn trứng cá có rất nhiều nguyên nhân nên càng giảm thiểu được nguyên nhân bạn càng dễ kiểm soát. Hy vọng rằng bạn sẽ thấy có ích 😝😍 #tomskincare #goclamdep #cloggedpores #acneproneskin #acne #skincare ,2024-06-19 16:57:20,19/06/2024,False,https://www.tiktok.com/@tomskincare,nhạc nền - tomskincare,7382151318527281937,https://www.tiktok.com/@tomskincare/video/7382151283420957968,219,9751,356,335300,2017,382,"tomskincare, goclamdep, cloggedpores, acneproneskin, acne, skincare",False,False,tomskincare,False,True,False,1,6,41,0,0,1,0,0,0
"Top 1 bí quyết làm đẹp cho vùng mắt đây mọi người ơi. Cùng thử kiên trì để giảm nếp nhăn li ti, ngừa sắc tố vùng mắt nha!! Sản phẩm nào cũng được miễn hợp da 😀🤓😘 #tomskincare #goclamdep #skincaretips #beautytok #skintok ",2024-06-17 16:16:28,17/06/2024,False,https://www.tiktok.com/@tomskincare,original sound - tomskincare,7381398635311532816,https://www.tiktok.com/@tomskincare/video/7381398568210271504,134,6747,152,319400,1845,178,"tomskincare, goclamdep, skincaretips, beautytok, skintok",False,False,tomskincare,False,True,False,1,5,37,0,0,1,0,0,0
"🥹 5 lý do khiến mụn ẩn tràn lan li ti sần toàn mặt... Mình có note vài tips skincare cũng thuộc hàng bí quyết khi nói đến giải pháp cho mụn ẩn. Mn có thể tham khảo nhaaa 🙂🙂 Chúc mọi người sớm mịn màng trở lại 😂 

#tomskincare #goclamdep #skincaretips #beautytok #cloggedpores #munan ",2024-06-13 17:12:36,13/06/2024,False,https://www.tiktok.com/@tomskincare,Quirky Suspenseful Indie-Comedy(1115050),7021206401636632577,https://www.tiktok.com/@tomskincare/video/7379928697148689681,138,19400,712,612800,3884,611,"tomskincare, goclamdep, skincaretips, beautytok, cloggedpores, munan",False,False,tomskincare,False,True,False,3,6,46,0,0,1,0,0,0
"Sữa rửa mặt panoxyl giúp cho da mụn (mụn ẩn hay viêm cũng oke). Ko chỉ có thế, nó còn giúp mụn trên lưng giảm rõ rệt. Tuy nhiên, nó khá khó dùng. Mọi người nên nghe kỹ cách dùng trong đây. Đây là sữa rửa mặt rất mạnh nên đừng chủ quan kẻo sẽ bị kung da nha! #tomskincare #goclamdep #skincaretips ##beautytok##reviewskincare##cloggedpores##acneproneskin",2024-06-10 17:20:16,10/06/2024,False,https://www.tiktok.com/@tomskincare,original sound - tomskincare,7378817594100304641,https://www.tiktok.com/@tomskincare/video/7378817416064699665,90,22000,1383,675000,7025,738,"tomskincare, goclamdep, skincaretips, beautytok, reviewskincare, cloggedpores, acneproneskin",False,False,tomskincare,False,True,False,0,7,60,0,0,1,0,0,0
"Rating các sản phẩm trị mụn ẩn đình đám trên thế giới (thật sự là vươn tầm thế giới). Vấn đề mụn ẩn ko chỉ gây khó ở cho các babies ở VN đâu huhu... Mọi người thấy sao? Hy voing vid sẽ đóng góp gì đó cho cộng đồng người bị mụn ẩn (clogged pores, whiteheads) #tomskincare #goclamdep #beautytok #skincaretips #reviewlamdep #reviewskincare #cloggedpores ",2024-06-07 17:51:12,07/06/2024,False,https://www.tiktok.com/@tomskincare,original sound - tomskincare,7377712215901211409,https://www.tiktok.com/@tomskincare/video/7377712137755577616,191,13200,279,465300,3642,549,"tomskincare, goclamdep, beautytok, skincaretips, reviewlamdep, reviewskincare, cloggedpores",False,False,tomskincare,False,True,False,0,7,57,0,0,1,0,0,0
Top 10 sản phẩm skincare không cần thiết phải có... 😩🤣❌ Mình đã thử =)) mời các bạn xem. Hy vọng nội dung sẽ giúp bạn tiết kiệm thêm nhiều tiền nhen 💆‍♂️💰  #tomskincare #goclamdep #beautytok #skincaretips ,2024-06-03 17:31:35,03/06/2024,False,https://www.tiktok.com/@tomskincare,original sound - tomskincare,7376222797674744593,https://www.tiktok.com/@tomskincare/video/7376222728237419792,292,136300,4647,2500000,23200,2714,"tomskincare, goclamdep, beautytok, skincaretips",False,False,tomskincare,False,True,False,4,4,32,0,0,1,0,0,0
Lần đầu tiên quay get ready with me 🫡😴🤣. Chúc mọi người một ngày nhìu niềm zui! 😇 #grwm #tomskincare #goclamdep #beautytok ,2024-05-31 16:10:57,31/05/2024,False,https://www.tiktok.com/@tomskincare,original sound - tomskincare,7375088789418461969,https://www.tiktok.com/@tomskincare/video/7375088684883922192,179,6772,58,345900,517,215,"grwm, tomskincare, goclamdep, beautytok",False,False,tomskincare,False,True,True,2,4,17,0,0,1,0,0,0
3 lỗi sai khi mọi người trị mụn ẩn... 😓 Nếu chẳng may mắc phải thì da rất dễ mẩn đỏ. Mình thường dùng kem dưỡng để làm dịu và phục hồi. Trong đây mình cũng review nhanh những loại kem đó. Mời mọi người tham khảo! #tomskincare #goclamdep #beautytok #reviewlamdep #reviewskincare #cloggedpores #munan ,2024-05-29 17:59:55,29/05/2024,False,https://www.tiktok.com/@tomskincare,original sound - tomskincare,7374374655505042177,https://www.tiktok.com/@tomskincare/video/7374374609375792385,140,32500,758,1100000,9480,590,"tomskincare, goclamdep, beautytok, reviewlamdep, reviewskincare, cloggedpores, munan",False,False,tomskincare,False,True,False,1,7,46,0,0,1,0,0,0
❌3 lỗi sai trị mụn và cách khắc phục. Mình thấy nhiều người gặp và mụn thì nặng hơn nên hy vọng sau video mọi người sẽ xác định rõ hơn vấn đề mụn của mình để có thể tự giúp được bản thân nhé 🤞😍🥰 #tomskincare #goclamdep #skincaretips #beautytok #acneproneskin #acne ,2024-05-26 17:07:15,26/05/2024,False,https://www.tiktok.com/@tomskincare,original sound - tomskincare,7373247841700973329,https://www.tiktok.com/@tomskincare/video/7373247787800087809,199,19000,411,508800,4051,400,"tomskincare, goclamdep, skincaretips, beautytok, acneproneskin, acne",False,False,tomskincare,False,True,False,2,6,45,0,0,1,0,0,1
"Bí kíp skincare thu nhỏ lỗ chân lông to cho da mịn màng có thật sự tồn tại? 🙂‍↕️🙂‍↕️ Nó vẫn sẽ tuỳ theo bạn muốn ""nhỏ"" đến mức nào. Nếu muốn giống mình, hãy bật filter thay vì mua thêm một đống đồ skincare thu nhỏ lỗ chân lông nha 😂😂😂😂

#tomskincare #goclamdep #skincaretips #beautytok ",2024-05-24 17:14:27,24/05/2024,False,https://www.tiktok.com/@tomskincare,original sound - tomskincare,7372507518272097025,https://www.tiktok.com/@tomskincare/video/7372507467927850256,162,28500,1371,894200,9457,417,"tomskincare, goclamdep, skincaretips, beautytok",False,False,tomskincare,False,True,False,3,4,51,0,0,1,0,0,0
